"username","date","retweets","favorites","text","geo","mentions","hashtags","id","permalink","emoji"
"DrSerranoMartin","2019-09-30 17:11","3","6","@insight_centre @CreateIoT_eu @ACTIVAGEproject this is what we do when we are not writing sience, #EPE activities @DCUalpha #iotschool #AirQuality-MobileLab collecting weather and air quality data pic.twitter.com/zCXv79xFou","","@insight_centre @CreateIoT_eu @ACTIVAGEproject @DCUalpha","#EPE #iotschool #AirQuality","1178703944404615169","https://twitter.com/DrSerranoMartin/status/1178703944404615169",""
"johnpeavoy","2019-09-29 15:40","0","1","Catching up here @TomRaftery and spotted that air quality monitor you recently acquired in last week’s ft_weekend financialtimes magazine. Had you seen the article? If not, happy to share. @ Rochestown, Cork, Ireland https://www.instagram.com/p/B2_7GD-ncqG/?igshid=b5rzv8dmwjrg …","","@TomRaftery @","","1178318550886432768","https://twitter.com/johnpeavoy/status/1178318550886432768",""
"dulsel14","2019-09-26 09:24","0","0","Good responsible Gov should  balance tax on ability to pay I am of the opinion that most of this carbon tax should be shouldered by big corporations who are responsible for poor air quality. Motorist are going to be hit you can get rid of the car and use P, transport or go elect https://twitter.com/rtenews/status/1176891011466977280 …","","","","1177136844674412544","https://twitter.com/dulsel14/status/1177136844674412544",""
"newsbicky","2019-09-25 10:14","0","1","Poor air quality too. Very noticeable. Most drivers have no choice due to already jam-packed public transport at ""peak times"" and many need to drive children to creches etc before work. Two crashes caused extra gridlock today. Better laws, resources and plans needed in my view.","","","","1176787040446427136","https://twitter.com/newsbicky/status/1176787040446427136",""
"rte","2019-09-25 07:23","10","16","Publishing its annual air quality report to mark World Lung Day, the EPA says it is increasingly concerned about rising levels of pollution in Ireland    https://www.rte.ie/news/2019/0925/1077992-air-pollution-epa/ …","","","","1176743958145306625","https://twitter.com/rte/status/1176743958145306625",""
"DublinLoop","2019-09-25 00:37","1","1","Poor air quality prematurely killing over 1,100 in Ireland each year https://jrnl.ie/4823103 ","","","","1176641779355049984","https://twitter.com/DublinLoop/status/1176641779355049984",""
"MartinB49200842","2019-09-24 17:53","0","0","Why try to blur the issue?   Burning Oil products is what is damaging air quality, children’s lungs and brain development and also fuelling Climate change. People aren’t standing for corporate / political lies. Thank Greta. There is No issue with using oil in non combustible ways.","","","","1176540046024957954","https://twitter.com/MartinB49200842/status/1176540046024957954",""
"newsbicky","2019-09-20 16:37","0","1","A planned phase-out of diesel and petrol vehicle use over next few years with engagement with EV importers and ESB etc would be a must for me in the next general election. Air quality is also an urgent issue.","","","","1175071463671513090","https://twitter.com/newsbicky/status/1175071463671513090",""
"KeithMillsD7","2019-09-20 12:42","0","0","There is a much much stronger case for removing cars from our cities based on air quality than any ""climate change"" impact.","","","","1175012377999347714","https://twitter.com/KeithMillsD7/status/1175012377999347714",""
"MiSheridan","2019-09-20 09:11","0","2","So many factors play a part - so any calculator would be a blunt instrument. The air quality debate is clear cut at point of use - but again where is the power sourced... #itscomplicated","","","#itscomplicated","1174959201988145153","https://twitter.com/MiSheridan/status/1174959201988145153",""
"newsbicky","2019-09-19 09:27","0","0","Another good reason here from scientists to quickly phase out the use of petrol and diesel cars!  #ClimateEmergency #AirQuality #ChildrenFirstpic.twitter.com/jbUkc3GwKA","","","#ClimateEmergency #AirQuality #ChildrenFirstpic","1174600836338671616","https://twitter.com/newsbicky/status/1174600836338671616",""
"CRAClabUCC","2019-09-13 16:54","8","33","We are delighted to be working with @corkcitycouncil on their new #AirQuality monitoring initiative. #cork #cleanairpic.twitter.com/JerEbbZZyc","","@corkcitycouncil","#AirQuality #cork #cleanairpic","1172538937916710912","https://twitter.com/CRAClabUCC/status/1172538937916710912",""
"Merryse235","2019-09-04 16:15","0","1","No one is claiming this is going to solve the climate emergency are they? But we want to improve air quality in our school playgrounds and see if this has any impact. Or are you saying we shouldn't do anything at all unless it's shown to single handedly address climate change?!","","","","1169267816962363392","https://twitter.com/Merryse235/status/1169267816962363392",""
"Aily_NC","2019-09-04 11:46","0","0","Least Dublin got its smoky coal ban in the 90s. I'm not looking forward to with winter ahead with PM2.5 shooting up above WHO guidelines. We've the data to show the improved air quality in Low Smoke Zones but once again government delaying the national smoky coal ban. https://twitter.com/1GaryGannon/status/1168794264681308163 …","","","","1169199981896654850","https://twitter.com/Aily_NC/status/1169199981896654850",""
"boggywood","2019-08-30 09:56","2","3","2/Have any effect in the climate either .They will no doubt have problems with pollution & air quality in cities but  it won't effect the climate .What we *WILL* do is put completely avoidable extreme hardship on ourselves ,by deliberately putting people into fuel poverty ,","","","","1167360460146057217","https://twitter.com/boggywood/status/1167360460146057217",""
"DeirdreConroyIE","2019-08-09 08:36","0","1","Diesel fume increase outside new national children’s hospital queried by Children’s Health Ireland. Illogical traffic system for St James’s Hospital. Why am I not surprised? @noCBC_here    BusConnects plan effect on air quality at St James’s Hospital queried https://www.irishtimes.com/news/environment/busconnects-plan-effect-on-air-quality-at-st-james-s-hospital-queried-1.3980940 …","","@noCBC_here","","1159730211853885440","https://twitter.com/DeirdreConroyIE/status/1159730211853885440",""
"DubLoony","2019-08-07 19:49","1","4","Hi @IrishWater Works going on at SCR Rialto is causing a huge amount of dust, disturbed each time a car goes by. Any change it could be damped down? Between it, the building of the medical centre & hospital work in St.James means air quality locally is poor. Thanks. pic.twitter.com/qkADiL9Wn2","","@IrishWater","","1159174864265261057","https://twitter.com/DubLoony/status/1159174864265261057",""
"BrianLeddin","2019-08-02 07:17","0","1","We'll need quite a few of these, not just one, to give a clear picture of the air quality. @LimerickCouncil @LimerickEnviron","","@LimerickCouncil @LimerickEnviron","","1157173547464351744","https://twitter.com/BrianLeddin/status/1157173547464351744",""
"oregan_reine","2019-07-28 13:17","0","0","@Ryanair how do you check the oxygen air quality in your plane? During our flight last night I could hardly breathe for long parts of the flight and a man got a dreadful panick attack, which required to call emergency. How do you explain such stuff and poor air quality?","","@Ryanair","","1155452139516440576","https://twitter.com/oregan_reine/status/1155452139516440576",""
"cormacDublin","2019-07-25 12:57","0","0","@ciarakellydoc  Another reason for Hart's corner being unsuitable location for a crèche is the Air quality in the location one of the busiest junctions in the north side of Dublin","","@ciarakellydoc","","1154359906314739712","https://twitter.com/cormacDublin/status/1154359906314739712",""
"Beyondpassive","2019-07-23 12:36","0","6","The experience of stepping to nZEB in ROI, would suggest moving away from comparative assessment calculations, to actual energy calculations. Air quality, vapor control, leakage, thermal comfort and overheating control become more critical as you go higher performance.","","","","1153629889158877184","https://twitter.com/Beyondpassive/status/1153629889158877184",""
"GalwayCycling","2019-07-19 13:39","0","0","TLDR  Cars reduce air quality. More cars even more    While you're there, Google induced demand & road-building    Using cars less for short trips is the only long-term way to improve urban air quality.  Without it, a bypass will only work temporarily & there'll be more driving overall","","","","1152196290811506689","https://twitter.com/GalwayCycling/status/1152196290811506689",""
"SadhbhO","2019-07-17 00:30","1","3","Yeah.. let's all be bad guys. Flights to water-scarce and overheating Mediterranean, toxic air quality and draughty houses... that is REAL progress! @climatecaseire    Opinion: When it comes to climate change, is the petroleum industry the only 'bad guy'?https://jrnl.ie/4727044 ","","@climatecaseire","","1151272819390603264","https://twitter.com/SadhbhO/status/1151272819390603264",""
"obosdirect","2019-07-15 17:39","0","1","There are many benefits to having plants in the office, improves air quality, reduces stress... personally I just like coming in on Mondays and seeing if the are still alive :+) @ O'Brien Office Systems https://www.instagram.com/p/Bz8cYteClEH/?igshid=72d0nrrlgqxq …","","@","","1150807217026867201","https://twitter.com/obosdirect/status/1150807217026867201",""
"Quentin_OConnor","2019-07-14 15:27","0","3","Love this, @TidyTownsIre make it happen! Could be a great incentive for communities to start the change in getting air quality back to acceptable levels. https://twitter.com/DublinVelo2019/status/1150356529641644033 …","","@TidyTownsIre","","1150411416559652866","https://twitter.com/Quentin_OConnor/status/1150411416559652866",""
"MandiNgwane","2019-07-11 09:54","0","0","As having worst air quality, isn’t it? Johannesburg isn’t one of them","","","","1149240503952654336","https://twitter.com/MandiNgwane/status/1149240503952654336",""
"newsbicky","2019-07-10 13:05","0","0","Ireland, in my view, has an opportunity to lead by implementing an immediate ban on all diesel and petrol fueled vehicles in cities and towns while working with EV companies to help replace cars. This is an urgent health emergency after all. Children deserve better. #AirQuality https://twitter.com/KOSullivanIT/status/1148656526606950400 …","","","#AirQuality","1148926095284215814","https://twitter.com/newsbicky/status/1148926095284215814",""
"boggywood","2019-07-09 21:26","0","0","2/Listened then either .In respect to ""carbon emissions"".There is no such thing .""Carbon"" is soot CO2 is plant food  Localized air quality in an Urban Heat Island  has nothing to do with the atmosphere & has zero effect on the climate pic.twitter.com/gyWQc7LlrR","","","","1148689852873007104","https://twitter.com/boggywood/status/1148689852873007104",""
"boggywood","2019-07-09 21:19","0","0","Air quality has everything to do with vehicles & in particular the last time activistd & Government persuaded large numbers of people in this country & elsewhere to replace petrol with Diesel because ""it was far better for the environment"" .It was in fact, the opposite.But nobody","","","","1148688108952674304","https://twitter.com/boggywood/status/1148688108952674304",""
"DubCham","2019-07-09 20:49","40","218","The Dutch city of Utrecht has added ‘green’ roofs to more than 300 bus shelters in a bid to improve air quality. Should we do the same in Dublin? #BetterDublinpic.twitter.com/j7nfvcrTCd","","","#BetterDublinpic","1148680634103160832","https://twitter.com/DubCham/status/1148680634103160832",""
"donna_cooney1","2019-07-09 18:15","2","4","Letter from all  @greenparty_ie DCC councillors to Owen Keegan @DubCityCouncil on our concerns with public health #Airpollution and and our request for an Air Quality  Plan for #Dublin City.pic.twitter.com/ouKS13rRDz","","@greenparty_ie @DubCityCouncil","#Airpollution #Dublin","1148641796420984832","https://twitter.com/donna_cooney1/status/1148641796420984832",""
"GalwayCycling","2019-07-09 14:35","0","0","That is the line of thinking. Would be great to show directly that initiatives like @cycle_bus or infrastructure improvements for safer cycling and walking have an effect on air quality at schools also.","","@cycle_bus","","1148586423144128512","https://twitter.com/GalwayCycling/status/1148586423144128512",""
"GalwayCycling","2019-07-09 12:47","4","3","Air quality as measured by particulate matter at Rahoon Road air monitoring station 👇    WHO safe limits for PM₁₀ are below 20 μg/m³. How many days can you count in excess of this?    Data are only available after the fact - out of date by a month. And no measurement of PM₂.₅ pic.twitter.com/gRtyN0zg1l","","","","1148559347515121664","https://twitter.com/GalwayCycling/status/1148559347515121664","👇"
"donna_cooney1","2019-07-09 10:15","3","11","Levels over 40 ug/m3 exceeed EU ambient air quality directive Pearse Street is over 60 ug/m3. Dublin needs an Air Quality Management plan urgently. Will be requesting special meeting to address this. @DubCityCouncil @LordMayorDublinpic.twitter.com/EGHOWpw2mx","","@DubCityCouncil @LordMayorDublinpic","","1148520971923533824","https://twitter.com/donna_cooney1/status/1148520971923533824",""
"donna_cooney1","2019-07-09 09:55","2","13","EU ambient air quality directive also states activities must halt if values exceeded. I raised this as in relation to the port tunnel during consultation & pedestrian association report to DCC in 90's #Dublin traffic pollution poses public health risk -EPAhttps://www.rte.ie/news/ireland/2019/0708/1060952-nitrogen-oxide/ …","","","#Dublin","1148516030693744640","https://twitter.com/donna_cooney1/status/1148516030693744640",""
"jakwilde","2019-07-09 09:30","0","1","How does the @EPAIreland know? I am of the opinion that they didn't think that recording air quality is important and so routinely refused to do so!","","@EPAIreland","","1148509721948819456","https://twitter.com/jakwilde/status/1148509721948819456",""
"CMacCoille","2019-07-09 08:23","4","20","A lot of detailed information in the @irishtimes on that @EPAIreland report, such as where Dublin air quality testing points are located... or not located, such as in  Phibsborough, Ranelagh, Stoneybatter, the Liberties, Donnybrook, Inchicore, not to mention many outer suburbs. pic.twitter.com/R7SzbGL5mS","","@irishtimes @EPAIreland","","1148492842605645825","https://twitter.com/CMacCoille/status/1148492842605645825",""
"f_pilla","2019-07-06 13:39","5","27","I’m proud to lead @iSCAPEproject and our framework adopting 'Living Labs' as a participative democracy ecosystem to inform better policies and technology deployments to improve #AirQuality in cities https://twitter.com/CORDIS_EU/status/1146752436549427200 …pic.twitter.com/g0kMtlArER","","@iSCAPEproject","#AirQuality","1147485265033932801","https://twitter.com/f_pilla/status/1147485265033932801",""
"jakwilde","2019-07-04 09:00","1","4","Interesting also as the Irish Govt and the EPA, feel that measuring Air Quality in Ireland is beneath them.","","","","1146690216897515520","https://twitter.com/jakwilde/status/1146690216897515520",""
"brencooney","2019-07-02 14:35","0","1","And another benefit,   Cleaner town and city air  #AirQuality #PM10 #PM2.5","","","#AirQuality #PM10 #PM2","1146049697745948672","https://twitter.com/brencooney/status/1146049697745948672",""
"Keegan1Andrew","2019-07-01 18:50","0","0","Luxemburg and Lativia all ready have free transport.  Cost paid for by getting rid of tax loopholes for vultures and the wealthy. Transaction Tax of just .5 percent will generate 500million. Improved air quality will save 50 million in health costs and hundreds of lives annually.","","","","1145751642865905664","https://twitter.com/Keegan1Andrew/status/1145751642865905664",""
"LTovander","2019-07-01 11:48","0","0","US Air Quality Isn’t Slipping: Taking a Closer Look at the Data https://junkscience.com/2019/06/us-air-quality-isnt-slipping-taking-a-closer-look-at-the-data/ … via @JunkScience","","@JunkScience","","1145645390479470592","https://twitter.com/LTovander/status/1145645390479470592",""
"JerryDMurphy66","2019-06-29 14:32","0","21","Sarah: We need big investment in public transport to get us out of car. More frequent trains with cheaper fares than equivalent car journey. EV will improve air quality and C sustainability but not traffic. Govt should invest in trains, buses and bike infrastructure.","","","","1144961872451575809","https://twitter.com/JerryDMurphy66/status/1144961872451575809",""
"DublinCARO","2019-06-27 19:50","0","2","Thanks John. Similar to the same period last year at this new #airquality site when the temperatures rose #cleanair #ClimateActionhttps://twitter.com/johnwenger9/status/1144306589958103040 …","","","#airquality #cleanair #ClimateActionhttps","1144316967270211584","https://twitter.com/DublinCARO/status/1144316967270211584",""
"brencooney","2019-06-27 10:55","0","4","@wexfordcoco in conjunction with @CIT_ie. The equipment was lent to them as part of a comparison project with other #airquality equipment funded by @EPAIreland   Secretly #wexford has expanded it county boundaries into @corkcoco but say nothing! They haven't noticed.","","@wexfordcoco @CIT_ie @EPAIreland @corkcoco","#airquality #wexford","1144182434268889088","https://twitter.com/brencooney/status/1144182434268889088",""
"PBalban","2019-06-26 12:16","3","14","Declining air quality is the key reason why we need to look for sustainable alternatives for last mile deliveries giving other options to the traditional diesel van spewing particulates within inner cities. #gibraltar @VelocitySeries #airquality #sustainability #environment","","@VelocitySeries","#gibraltar #airquality #sustainability #environment","1143840426471886849","https://twitter.com/PBalban/status/1143840426471886849",""
"DublinCARO","2019-06-26 10:39","5","6","@sabrinadekker opening the #AirQuality and congestion session at #vc19 #cycledublin this morning @DCUClimate @DubCityCouncil @EPAAirQuality @EPAClimateNewspic.twitter.com/xfE4U5rOHF","","@sabrinadekker @DCUClimate @DubCityCouncil @EPAAirQuality @EPAClimateNewspic","#AirQuality #vc19 #cycledublin","1143816051530113025","https://twitter.com/DublinCARO/status/1143816051530113025",""
"AndreaVoigt2305","2019-06-25 10:50","0","0","Interesting comment from the audience: link #energyefficiency with indoor air quality #iaq and health - bring communities together! Consumer awareness is key for success!  #energyefficientworldpic.twitter.com/Ae5P2FXpSA","","","#energyefficiency #iaq #energyefficientworldpic","1143456336337879040","https://twitter.com/AndreaVoigt2305/status/1143456336337879040",""
"HugoFitzpatrick","2019-06-24 18:46","0","0","And to think I remember a WHO report on cities with the worst air quality and we were happy and clean at 13 or something... 3 years ago 😨 Worst was like 240 and virtually uninhabitable. https://twitter.com/DublinVelo2019/status/1143163544919302146 …","","","","1143213848327012352","https://twitter.com/HugoFitzpatrick/status/1143213848327012352","😨"
"sineadmaguire","2019-06-23 22:10","2","4","The effects of smoky coal on air quality is hugely underestimated. It may not be in the interest of vested groups, but enforcing the ban will lead to an improvement of air quality resulting in a better quality of life and  better health for all in our community","","","","1142902698964062208","https://twitter.com/sineadmaguire/status/1142902698964062208",""
"sineadmaguire","2019-06-23 22:10","2","8","I am calling on @sligococo to do more to enforce the Smoky Coal Ban in #Sligo as poor air quality is affecting health.People have voiced their concerns to me regarding air quality. In particular, those out getting exercise tend to avoid certain areas due to excessive smoke. pic.twitter.com/kGInNx8d8u","","@sligococo","#Sligo","1142902695801569280","https://twitter.com/sineadmaguire/status/1142902695801569280",""
"mgtmaryrose","2019-06-19 22:30","0","0","@EPAResearchNews What's with the new format for air quality, I can't understand it at all??????","","@EPAResearchNews","","1141458135292555264","https://twitter.com/mgtmaryrose/status/1141458135292555264",""
"JerryDMurphy66","2019-06-12 19:02","8","23","Great paper from @margueritenyhan of @UCC @eriucc @MaREIcentre @scienceirel in collaboration with @Harvard highlighting air quality impact on lung function @osheaucc @UCCResearch @CullotyS @johbeeshttps://twitter.com/margueritenyhan/status/1138851357161676800 …","","@margueritenyhan @UCC @eriucc @MaREIcentre @scienceirel @Harvard @osheaucc @UCCResearch @CullotyS @johbeeshttps","","1138869203824455680","https://twitter.com/JerryDMurphy66/status/1138869203824455680",""
"iamreddave","2019-06-08 21:13","0","1","Ah cool, thanks for the reply  I hope the air quality sensor starts behaving soon.","","","","1137452567213027328","https://twitter.com/iamreddave/status/1137452567213027328",""
"brencooney","2019-06-07 12:40","3","15","With Alan Corcoran on @SouthEastRadio Morning Mix and @JohnSodeau of @UCC @CRAClabUCC discussing #AirQuality in #wexford #PM10 #PM2.5pic.twitter.com/24kBy8Ol0u","","@SouthEastRadio @JohnSodeau @UCC @CRAClabUCC","#AirQuality #wexford #PM10 #PM2","1136961239878254592","https://twitter.com/brencooney/status/1136961239878254592",""
"GaryJk64","2019-06-05 15:36","0","0","I am talking about bus stops and cycle paths Air quality is a different discussion. Please stay on track. The designs and accident stats are there to be seen but they are ignored. These are facts. Read Trinity Haus NDA doc itt really does tell the story","","","","1136280601118609412","https://twitter.com/GaryJk64/status/1136280601118609412",""
"brencooney","2019-06-05 14:06","0","1","Where @wexfordcoco lead with realtime #airquality monitoring since 2014, @EPAAirQuality follows?  😎","","@wexfordcoco @EPAAirQuality","#airquality","1136257910755995649","https://twitter.com/brencooney/status/1136257910755995649","😎"
"CRAClabUCC","2019-06-05 13:30","2","6","It's all in the new air quality monitoring programme. Here  is the map of proposed locations pic.twitter.com/G4jPOUhASS","","","","1136248875512152065","https://twitter.com/CRAClabUCC/status/1136248875512152065",""
"olivergburke","2019-06-04 12:21","0","0","State of the environment UK soil, air, water quality reports out today. Arable soils losing up to 60% of organic carbon. https://www.farminguk.com/news/arable-soils-losing-up-to-60-of-organic-carbon-report-says_53145.html#.XPZTayUDWqk.twitter … #soil #SoilHealth #AirQuality #Waterpic.twitter.com/NMcFxBrVEz","","","# #soil #SoilHealth #AirQuality #Waterpic","1135869100960473088","https://twitter.com/olivergburke/status/1135869100960473088",""
"SiMcKeag","2019-05-25 19:17","2","13","Housing. Public transport. Quality of life. Healthcare. Air quality. Climate action not just ignored, but actively twarted. Our natural heritage in freefall. That's the message you need to take home. #LE2019 #EP2019https://twitter.com/rtenews/status/1132335233616011264 …","","","#LE2019 #EP2019https","1132349880666644482","https://twitter.com/SiMcKeag/status/1132349880666644482",""
"AhernEoin","2019-05-22 09:31","0","3","That's a fair point. While electrolysis paired with wind is a great option for Ireland's cities too (in addition to bio-CNG), unfortunately we place no value on air quality. And as a result we're now locking ourselves into diesel again for another decade. It's disappointing.","","","","1131115373049372672","https://twitter.com/AhernEoin/status/1131115373049372672",""
"torban69","2019-05-17 16:32","0","0","Oops.   Malfunction leads to ‘poor air quality’ warning in Cork https://www.echolive.ie/corknews/Malfunction-leads-to-poor-air-quality-warning-in-Cork-4c82b2cf-de02-43bc-a34a-e2e5e722a706-ds#.XN7T0CfHk-o.twitter …","","","#","1129409277897191426","https://twitter.com/torban69/status/1129409277897191426",""
"polly_galway","2019-05-09 06:56","1","0","Fresh mountain #smog? 96% of US #NationalParks have hazardous #AirQuality – scary study.  One solution is an electric transit system and stopping individual vehicles from entering? Some parks are horrendously busy with long lines of traffic.    https://www.theguardian.com/environment/2019/may/08/national-park-air-quality-hazardous-study?CMP=Share_AndroidApp_Tweet …","","","#smog #NationalParks #AirQuality","1126365359550939136","https://twitter.com/polly_galway/status/1126365359550939136",""
"ZoeHealy3","2019-05-06 08:51","0","1","Why so low 10%? Walking should b default, then cycling, then pub trans then car. For personal health, air quality, combatting obesity and saving the planet... Needs to be at the top of the agenda","","","","1125307077302288384","https://twitter.com/ZoeHealy3/status/1125307077302288384",""
"irish2witter","2019-05-03 15:17","0","0","Depends on the level of insulation and the price of electricity versus gas. With correct installation heat pumps have higher capex but much lower lifetime cost and better air quality","","","","1124316981166055429","https://twitter.com/irish2witter/status/1124316981166055429",""
"KevinBoyleYoga","2019-04-30 18:06","2","4","We are the indoor generation. We spend 90% of our life indoors according to the US Environmental Protection Agency - Importance of Indoor Air Quality     This summer, I hope to teach some outdoor yoga with @HappeningsIRE 😎     More info coming soon!    #kevinboyleyoga #happeningsyogapic.twitter.com/9Vpj7xVie9","","@HappeningsIRE","#kevinboyleyoga #happeningsyogapic","1123272513960783872","https://twitter.com/KevinBoyleYoga/status/1123272513960783872","😎"
