"username","date","retweets","favorites","text","geo","mentions","hashtags","id","permalink","emoji"
"aerpower","2019-09-28 16:35","4","11","Interesting thread on pheasants...    I think I recall a talk at the Irish ornithological conference that the biomass of introduced pheasants in the UK was greater than all other birds put together! https://twitter.com/TetZoo/status/1177508873948647431 …","","","","1177970045873508357","https://twitter.com/aerpower/status/1177970045873508357",""
"cpbyrne","2019-09-23 21:50","0","0","Massive amounts of biomass being shipped. What is the enrrgy balance for such shipments. There is a vast amount of dishonesty in this whole strategy. People need to wake up and question this left wing agenda of climate control. https://twitter.com/john_mcguirk/status/1176150426594533382 …","","","","1176237491659169793","https://twitter.com/cpbyrne/status/1176237491659169793",""
"DuncannonEIP","2019-09-17 18:40","1","7","A great day at #Ploughing19 with our project. Alongside @EIPAGRI_SP @agriculture_ie @DanuFarming and biomass to bio char EIP group. Thanks to all who called by. @NPAIEpic.twitter.com/VQZqom0dzM","","@EIPAGRI_SP @agriculture_ie @DanuFarming @NPAIEpic","#Ploughing19","1174015334627631104","https://twitter.com/DuncannonEIP/status/1174015334627631104",""
"john003","2019-08-26 18:19","0","1","We have shut down out single coal fired power station....Think the plan is replace with biomass.... pic.twitter.com/lXLFNxZdD8","","","","1166037498402934784","https://twitter.com/john003/status/1166037498402934784",""
"Rita_McInerney","2019-08-21 12:00","1","0","Instead of building 4 new power plants in Dublin why not look at feasible alternatives to reconfigure existing power plant at #MoneyPoint? Offshore Wind, Carbon Capture, Biomass. Why not is greed: just want security of supply in Dublin, no care for Balanced Regional Development https://twitter.com/RTEBrainstorm/status/1163758426041868289 …","","","#MoneyPoint","1164130237971664896","https://twitter.com/Rita_McInerney/status/1164130237971664896",""
"john003","2019-08-19 15:58","0","0","How much of the renewables are timber biomass....https://m.spiegel.de/international/germany/german-renewable-energy-policy-takes-toll-on-nature-conservation-a-888094.html …","","","","1163465166098448386","https://twitter.com/john003/status/1163465166098448386",""
"adriluzz1","2019-08-16 23:48","2","4","Earlier this week, interesting talk about biomass characterisation and analytical pyrolysis by Prof. Frederik Ronsse from #ugent during #abcsalt summer school 2019 @H2020_ABC_SALTpic.twitter.com/2FxMJYiinY","","@H2020_ABC_SALTpic","#ugent #abcsalt","1162496477773672448","https://twitter.com/adriluzz1/status/1162496477773672448",""
"john003","2019-08-09 12:13","0","0","Don't think Irish people will become vegans by 2050....Government policy on biomass is questionable is it really zero carbon? pic.twitter.com/oBRvRcSGuR","","","","1159784696521330689","https://twitter.com/john003/status/1159784696521330689",""
"john003","2019-08-03 13:11","0","0","A major part of new green CAP will be biomass production for farmers......Burning wood for electricity..https://www.desmog.co.uk/2019/07/04/creative-carbon-accounting-how-industry-and-government-make-burning-wood-look-climate-solution?amp&__twitter_impression=true …","","","","1157625108334338049","https://twitter.com/john003/status/1157625108334338049",""
"eosfuturedesign","2019-08-02 21:17","2","0","@peaksurfer Fine example of an Irish #regenerativeagriculture innovation that can replace biocidal control methods for nuisance biomass https://twitter.com/BBiochar/status/1157303787972911104 …","","@peaksurfer","#regenerativeagriculture","1157385000028975104","https://twitter.com/eosfuturedesign/status/1157385000028975104",""
"john003","2019-07-25 09:58","0","0","Biomass is going back to pre industrial age when wood was used for cooking and heating....https://www.desmog.co.uk/2019/07/04/creative-carbon-accounting-how-industry-and-government-make-burning-wood-look-climate-solution?amp&__twitter_impression=true …","","","","1154314911473917952","https://twitter.com/john003/status/1154314911473917952",""
"philkearney","2019-07-23 16:03","1","4","An Taisce Response to An Bord Pleanála Refusal of Permission for Co. Offaly Peat-Biomass Electricity Plant http://www.antaisce.org/ABP-Shannonbridge-Biomass …pic.twitter.com/BBRGtGDFnc","","","","1153682089507770368","https://twitter.com/philkearney/status/1153682089507770368",""
"RoryMcA_","2019-07-23 14:07","0","0","ESB refused permission to covert peat station to co-fire with biomass https://greennews.ie/esb-abp-peat-biomass/ …","","","","1153652832027009024","https://twitter.com/RoryMcA_/status/1153652832027009024",""
"john003","2019-07-23 10:15","0","1","Idea of bringing wood chipping from cutting down Australian trees 12000 to burn as biomass....Australia is semi desert needs its trees...Being allowed to call the chipping  zero carbon was a bit mad....We have a biomass power station already gets its wood from the US..","","","","1153594411508539393","https://twitter.com/john003/status/1153594411508539393",""
"john003","2019-07-21 16:58","0","0","Biomass also a bit suspect....https://www.desmog.co.uk/2019/07/04/creative-carbon-accounting-how-industry-and-government-make-burning-wood-look-climate-solution?amp&__twitter_impression=true …","","","","1152971210793394176","https://twitter.com/john003/status/1152971210793394176",""
"raymondofoghlu","2019-07-19 10:27","0","0","Really interesting. Does this mean biomass in general is out when it comes to power/heat generation?, even at high efficiencies?","","","","1152147899360403456","https://twitter.com/raymondofoghlu/status/1152147899360403456",""
"raymondofoghlu","2019-07-19 09:48","0","0","Thanks. So I see it has the highest emission but why is that not compensated by sequestration due to net afforestation (assuming the wood/biomass is sourced in europe).  @johnwenger9","","@johnwenger9","","1152138065919524864","https://twitter.com/raymondofoghlu/status/1152138065919524864",""
"MikeHoit","2019-07-18 10:00","1","3","This is incredible. Just think about the scale of the simultaneous emergence of all that insect biomass, and how many ants it must be... @Buzz_dont_tweethttps://twitter.com/SimonOKing/status/1151448175372357632 …","","@Buzz_dont_tweethttps","","1151778744413163520","https://twitter.com/MikeHoit/status/1151778744413163520",""
"john003","2019-07-17 23:22","0","0","Biomass produces more CO2 than coal....ESB is in process of bringing tons of lumber all the way from Australia to burn in power station....That is considered carbon neutral....https://www.desmog.co.uk/2019/07/04/creative-carbon-accounting-how-industry-and-government-make-burning-wood-look-climate-solution?amp&__twitter_impression=true …","","","","1151618159637651463","https://twitter.com/john003/status/1151618159637651463",""
"john003","2019-07-16 21:31","0","2","Biomass produces more CO2 than coal....Need to plant more trees not cut them down and bring then 12000 miles to Ireland...https://www.desmog.co.uk/2019/07/04/creative-carbon-accounting-how-industry-and-government-make-burning-wood-look-climate-solution?amp&__twitter_impression=true …","","","","1151227760595152896","https://twitter.com/john003/status/1151227760595152896",""
"john003","2019-07-16 20:16","1","3","Don't forget to mention ESB is bringing trees all the way from Ausralia to burn in a power station....It is biomass so it's all carbon neutral....https://www.rte.ie/amp/1061917/?__twitter_impression=true …","","","","1151209046369808384","https://twitter.com/john003/status/1151209046369808384",""
"SadhbhO","2019-07-15 16:03","1","11","Burning imported biomass to generate power is unsustainable and represents a poor energy return. It is only possible because of faulty accounting logic underpinning renewable subsidies. @AnTaisce  http://www.antaisce.org/articles/Response-BnM-biomass …","","@AnTaisce","","1150782900775919618","https://twitter.com/SadhbhO/status/1150782900775919618",""
"john003","2019-07-15 13:35","0","0","Is biomass really renewable....https://www.desmog.co.uk/2019/07/04/creative-carbon-accounting-how-industry-and-government-make-burning-wood-look-climate-solution?amp&__twitter_impression=true …","","","","1150745656665038850","https://twitter.com/john003/status/1150745656665038850",""
"john003","2019-07-15 13:14","0","2","Biomass produces as much CO2 as coal when it is burned...Burning wood is going back to pre industrial time.....https://www.desmog.co.uk/2019/07/04/creative-carbon-accounting-how-industry-and-government-make-burning-wood-look-climate-solution?amp&__twitter_impression=true …","","","","1150740513592676352","https://twitter.com/john003/status/1150740513592676352",""
"john003","2019-07-14 09:41","3","4","Biomass emits more CO2 than coal and trees are cut down  that will take decades to replace....It is calculated  as zero carbon however.....https://www.desmog.co.uk/2019/07/04/creative-carbon-accounting-how-industry-and-government-make-burning-wood-look-climate-solution?amp&__twitter_impression=true …","","","","1150324518726057984","https://twitter.com/john003/status/1150324518726057984",""
"paruss","2019-07-13 21:01","0","0","Laughing to myself watching the nine news, they are talking about shipping biomass from AUSTRALIA to burn in the Longford power plant! 😂 #gonuclear","","","#gonuclear","1150133044994555904","https://twitter.com/paruss/status/1150133044994555904","😂"
"SadhbhO","2019-07-09 21:03","2","11","ESB now has a new regime at Moneypoint in response of growing share of renewables in electricity generation,  and rising costs of EUAs. Less coal means less emissions,  but not zero emissions until we phase out gas peat and unsustainable biomass.  https://renews.biz/54164/renewables-force-esb-rethink-at-moneypoint/#.XSTxWnClcgg.twitter …","","","#","1148684149684940802","https://twitter.com/SadhbhO/status/1148684149684940802",""
"john003","2019-07-08 19:43","0","0","We are moving from Moneypoint coal to wind and biomass for electricity.. ...However even if biomass is officially calculated with zero carbon footprint..... It is just as bad as the coal it replaces....https://www.desmog.co.uk/2019/07/04/creative-carbon-accounting-how-industry-and-government-make-burning-wood-look-climate-solution?amp&__twitter_impression=true …","","","","1148301618204614656","https://twitter.com/john003/status/1148301618204614656",""
"john003","2019-07-08 13:31","0","2","Burning wood as Biomass not the answer.... https://www.desmog.co.uk/2019/07/04/creative-carbon-accounting-how-industry-and-government-make-burning-wood-look-climate-solution?amp&__twitter_impression=true …","","","","1148208103260925952","https://twitter.com/john003/status/1148208103260925952",""
"john003","2019-07-08 13:13","0","2","Biomass is not sustainable...Releases as much CO2 as coal...https://www.desmog.co.uk/2019/07/04/creative-carbon-accounting-how-industry-and-government-make-burning-wood-look-climate-solution?amp&__twitter_impression=true …","","","","1148203382080966659","https://twitter.com/john003/status/1148203382080966659",""
"eosfuturedesign","2019-07-08 08:01","0","3","Great pity it wasn’t a pyrolysis system that could have sequestered nearly 50% of the C in the biomass used. See @Biochar_IBI Combustion is a wasteful outdated  technology.  Who advised Kelly’s?","","@Biochar_IBI","","1148124817771696130","https://twitter.com/eosfuturedesign/status/1148124817771696130",""
"john003","2019-07-06 13:52","0","0","Stop using trees as Biomass....https://www.desmog.co.uk/2019/07/04/creative-carbon-accounting-how-industry-and-government-make-burning-wood-look-climate-solution?amp&__twitter_impression=true …","","","","1147488518706540546","https://twitter.com/john003/status/1147488518706540546",""
"john003","2019-07-05 22:25","2","2","Also stop burning trees as biomass....https://www.desmog.co.uk/2019/07/04/creative-carbon-accounting-how-industry-and-government-make-burning-wood-look-climate-solution?amp&__twitter_impression=true …","","","","1147255261310136320","https://twitter.com/john003/status/1147255261310136320",""
"john003","2019-07-05 20:35","2","4","Government should not support burning wood as biomass...Not good for the environment.... https://www.desmog.co.uk/2019/07/04/creative-carbon-accounting-how-industry-and-government-make-burning-wood-look-climate-solution?amp&__twitter_impression=true …","","","","1147227475791011840","https://twitter.com/john003/status/1147227475791011840",""
"john003","2019-07-05 15:01","0","0","Biomass not really a sustainable solution....https://www.desmog.co.uk/2019/07/04/creative-carbon-accounting-how-industry-and-government-make-burning-wood-look-climate-solution?amp&__twitter_impression=true …","","","","1147143408806440960","https://twitter.com/john003/status/1147143408806440960",""
"raymondofoghlu","2019-07-02 23:55","0","0","Just read that the game bird biomass released in UK manually is 46,000 tones. Interesting when compared to the TOTAL biomass of all UK wild native breeding birds 19,500 tonnes. that's mad!","","","","1146190609360871425","https://twitter.com/raymondofoghlu/status/1146190609360871425",""
"tom_hubert","2019-06-27 18:38","0","1","Yes different uses under consideration are fertiliser, solid biomass fuel or gasification.","","","","1144299030438174720","https://twitter.com/tom_hubert/status/1144299030438174720",""
"john003","2019-06-25 13:03","0","1","Yes planting trees good idea...Also they should not be used as biomass fuel...","","","","1143489915822530560","https://twitter.com/john003/status/1143489915822530560",""
"john003","2019-06-23 22:59","0","1","There is a electricity  plant in Ireland which gets its wood from the US 3500 miles away...That is seen as sustainable biomass and does not count to Ireland's carbon footprint...","","","","1142915112946348033","https://twitter.com/john003/status/1142915112946348033",""
"brites_Balcas","2019-06-21 10:13","1","1","The #SSRH supports only biomass fuels that are #sustainable, traceable and can achieve at least a 70% reduction of CO2 emissions. #WoodPellets achieve 92% in reduction in #Ireland. @IrishBioenergy #workshop #positivebalcasenergy","","@IrishBioenergy","#SSRH #sustainable #WoodPellets #Ireland #workshop #positivebalcasenergy","1141997603091025920","https://twitter.com/brites_Balcas/status/1141997603091025920",""
"Sorcha_Ni_Long","2019-06-13 14:27","2","13","Published ! Decoupling Abundance and Biomass of Phytoplankton Communities Under Different Environmental Controls: A New Multi-Metric Index https://www.frontiersin.org/article/10.3389/fmars.2019.00312 …","","","","1139162428275601414","https://twitter.com/Sorcha_Ni_Long/status/1139162428275601414",""
"4abrighterworld","2019-06-05 16:15","1","4","The main source of household air pollution is the indoor burning of fossil fuels, wood & other biomass-based fuels to cook, heat & light homes. Why not support our Stove Installation Programme by participating in the Mountain Challenge? #BeatAirPollution #WorldEnvironmentDaypic.twitter.com/UfyPs0IwmC","","","#BeatAirPollution #WorldEnvironmentDaypic","1136290349368958976","https://twitter.com/4abrighterworld/status/1136290349368958976",""
"ORSIreland","2019-06-04 15:19","0","1","Great news this morning! Minister @RichardbrutonTD has opened the second phase of the Support Scheme for Renewable Heat.  It will provide much needed operational support for biomass boilers & anaerobic digestion heating systems.  https://bit.ly/2EQ5sk8  #SSRH","","@RichardbrutonTD","#SSRH","1135914085013282816","https://twitter.com/ORSIreland/status/1135914085013282816",""
"iamreddave","2019-05-28 23:18","0","0","The other columns in the data are      timestamp,demand, frequency , coal , nuclear ,ccgt , wind ,pumped , hydro ,biomass ,oil ,solar , ocgt   and energy from/to other countries.     if there is some particular view you want to look at.","","","","1133497908513386497","https://twitter.com/iamreddave/status/1133497908513386497",""
"eurireland","2019-05-27 10:16","0","2","Biomass-based products have great potential to replace fossil-based materials: energy, textiles, plastics and chemicals and to create additional income and jobs in rural areas: @PhilHoganEU to @irishrurallink conference on #ClimateChange 👩‍🌾👩‍🌾👩‍🌾  Speech: https://ec.europa.eu/commission/commissioners/2014-2019/hogan/announcements/speech-commissioner-phil-hogan-irish-rural-link-conference-climate-change-opportunities-rural_en …pic.twitter.com/QvbgIfyoDa","","@PhilHoganEU @irishrurallink","#ClimateChange","1132938680484732928","https://twitter.com/eurireland/status/1132938680484732928","👩‍🌾 👨‍🌾 🌍"
"declancabra","2019-05-23 11:39","0","4","- No new fossil fuel infrastructure; Stop burning coal, peat and unsustainable biomass for electricity;  - Ban importing fracked gas and support a fossil free future globally.","","","","1131509864914718720","https://twitter.com/declancabra/status/1131509864914718720",""
"olivergburke","2019-05-18 11:33","0","1","At any one time it’s estimated there are 10 quintillion insects alive. That’s 10,000,000,000,000,000,000. By biomass they outnumber humans many times over. Habitat loss and widespread use of insecticides has led to plummeting insect numbers. #insects  https://www.weforum.org/agenda/2019/05/london-is-planting-a-giant-bee-corridor/ …pic.twitter.com/feVtWKQd6o","","","#insects","1129696484163751936","https://twitter.com/olivergburke/status/1129696484163751936",""
"GlengarriffWood","2019-05-12 10:28","4","11","Interesting @kerry_life conference #pearlmussels Pics: trials with log dams, silt fences & reseeding native grasses to reduce impacts of conifer clearfell; vegetation recovery after fencing farm streams; project poster,  Blackwater River: 2.7 million mussels = c300 tonnes biomass! pic.twitter.com/fWq7OW46MP","","@kerry_life","#pearlmussels","1127505702161977344","https://twitter.com/GlengarriffWood/status/1127505702161977344",""
"GrowersGrain","2019-05-07 15:41","0","0","Putting biomass at the heart of the renewable energy matter @AgrilandIrelandhttps://www.agriland.ie/farming-news/putting-biomass-at-the-heart-of-the-renewable-energy-matter/ …","","@AgrilandIrelandhttps","","1125772764684668929","https://twitter.com/GrowersGrain/status/1125772764684668929",""
"saoirse_mchugh","2019-05-03 13:16","0","1","Yes, biomass is unsustainable and so is exporting peat for gardens. The exciting thing about a transition is the possibilities that lie therein. as long as people are facilitated and supported there is not end to what communities can become!","","","","1124286640279699456","https://twitter.com/saoirse_mchugh/status/1124286640279699456",""
"eoind","2019-04-18 11:39","1","1","More precisely : nobody is against “zero-emissions”.  You can have a “renewable “ source that has a lot of emissions (eg biomass).  Nuclear power is zero emissions and renewable as it happens. Win-win! https://twitter.com/EnergyJvd/status/1118764600659456000 …","","","","1118826279573307392","https://twitter.com/eoind/status/1118826279573307392",""
"olivergburke","2019-04-15 19:08","0","0","Irish state aid for renewable heat generation from technologies including biomass and anaerobic digestion under the second phase of the Support Scheme for Renewable Heat has been approved by the EU Commission. https://www.independent.ie/business/farming/forestry-enviro/environment/eu-approve-irish-state-aid-request-for-anerobic-digestion-and-biomass-support-scheme-38017148.html …pic.twitter.com/7efeQWUycM","","","","1117852206919639041","https://twitter.com/olivergburke/status/1117852206919639041",""
