"username","date","retweets","favorites","text","geo","mentions","hashtags","id","permalink","emoji"
"IRISHINSAFIAN","2019-03-30 14:43","9","29","Earth Hour is being commemorated all over the world including Pakistan to show support for strategies that will help solve the problem of global warming. Let’s join a million across the world by switching off the lights b/w 8:30PM and 9:30PM in recognition of #EarthHour.pic.twitter.com/prYloBpK7o","","","#EarthHour","1112002482509619203","https://twitter.com/IRISHINSAFIAN/status/1112002482509619203",""
"leejaearly98","2019-03-29 15:19","0","0","Global warming has gotten so bad this year but I can’t help but feel chuffed that I’ll be sitting in a field under rays of sunshine sipping on cans with all my mates in a months time","","","","1111649109692370945","https://twitter.com/leejaearly98/status/1111649109692370945",""
"killian20002","2019-03-29 12:30","0","31","Fuck global warming, how am I supposed to know whether to bring my fleece or not","","","","1111606646135050240","https://twitter.com/killian20002/status/1111606646135050240",""
"GrrlGhost","2019-03-28 21:34","0","29","I think the chicken just told Millie about global warming 🥺 pic.twitter.com/MseRRGI4AO","","","","1111381080521609216","https://twitter.com/GrrlGhost/status/1111381080521609216","🥺"
"boggywood","2019-03-28 14:03","2","2","It took them 40 years to get this scam right. There were a number of failures eg. the the new ice age ,the Ozone hole, acid rain, global warming etc etc - they eventually hit on the sweet spot - ""in the inconvenient truth"" - appeal to people's good intentions & hubris  - come up","","","","1111267682018607110","https://twitter.com/boggywood/status/1111267682018607110",""
"JonathanFearon1","2019-03-28 11:14","0","4","First day of the year that ive got sunburnt!! #GlobalWarming","","","#GlobalWarming","1111224917050179584","https://twitter.com/JonathanFearon1/status/1111224917050179584",""
"foodsecurity_IE","2019-03-27 08:31","0","4","Ah yes - James, a ""fictitious meteorological researcher"" disagrees. James says ""Most of the things that have led to Global Warming were caused by nature itself"". 🤔🤔 @FolensIreland @MetEireann @1Hildegardehttps://twitter.com/think_or_swim/status/1110454821469990913 …","","@FolensIreland @MetEireann @1Hildegardehttps","","1110821580186243072","https://twitter.com/foodsecurity_IE/status/1110821580186243072","🤔 😏"
"JohnnyH1857","2019-03-25 06:40","0","3","People using a single football match as some type of proof that international football is in rude health is the equivalent of people who use a cold day as proof there’s no Global Warming. https://twitter.com/kdkilbane77/status/1109931527121633282 …","","","","1110068891466772480","https://twitter.com/JohnnyH1857/status/1110068891466772480",""
"boggywood","2019-03-24 21:46","0","0","2/New ice age 1970s, acid rain & the hole in the ozone layer 1980s, global warming 1990 until the 2000s when it got embarrassing because there was no warming & the climate went on a pause or 'hiatus' for 17 yes - so then we got Climate change- which is in itself a nonsense becaus","","","","1109934523393941507","https://twitter.com/boggywood/status/1109934523393941507",""
"NYCDubliner","2019-03-24 17:35","0","2","Global warming. It's messing with the seasons.","","","","1109871362984894465","https://twitter.com/NYCDubliner/status/1109871362984894465",""
"Khayden2412","2019-03-22 19:40","2","3","Watching the pictures and hearing the stories from #Mozambique should shame us all in the developed world. They who have contributed least to #GlobalWarming and #ClimateChange are the ones paying the most, while those of us contributing the most are suffering the least. Pic: @CNNpic.twitter.com/vIdUrEAlof","","@CNNpic","#Mozambique #GlobalWarming #ClimateChange","1109177974799122433","https://twitter.com/Khayden2412/status/1109177974799122433",""
"DavinaDevine","2019-03-22 02:05","1","2","Good lord it’s a very troppy night tonight in Dublin!! #GlobalWarming pic.twitter.com/yZYs8GTCW4","","","#GlobalWarming","1108912487146184704","https://twitter.com/DavinaDevine/status/1108912487146184704",""
"john003","2019-03-20 20:47","0","0","No link with global warming pic.twitter.com/bqHpg1fqxB","","","","1108470033829761026","https://twitter.com/john003/status/1108470033829761026",""
"cosaingalway","2019-03-20 16:49","0","0","Carlos believes CO2 is merely ""plant food"" and that the air quality in naval submarines is highly relevant to the Physics of global warming. https://twitter.com/LpdlcRamirez/status/1108381439198941185 …","","","","1108410167350251520","https://twitter.com/cosaingalway/status/1108410167350251520",""
"LinusRII","2019-03-19 22:09","0","1","These hot takes are contributing immeasurably to global warming","","","","1108128277154152450","https://twitter.com/LinusRII/status/1108128277154152450",""
"kilkeal","2019-03-19 19:06","0","0","No doubt some scientists will say it's proof of global warming https://twitter.com/EcoSenseNow/status/1107823100194902016 …","","","","1108082316897906689","https://twitter.com/kilkeal/status/1108082316897906689",""
"TheKavOfficial","2019-03-19 12:30","0","5","Mine is out in the garden since me wedding day, accounting for 38% of global warming.","","","","1107982635391991808","https://twitter.com/TheKavOfficial/status/1107982635391991808",""
"eosfuturedesign","2019-03-17 16:30","0","1","This destruction is undeniable even for those who question global warming;- reason alone to change our entire way of being on the Earth. https://twitter.com/extinctsymbol/status/1107238923061862404 …","","","","1107318260956049409","https://twitter.com/eosfuturedesign/status/1107318260956049409",""
"GaryTraynor21","2019-03-16 21:28","2","3","Wow, tell us what you really think love!!!!!     #GlobalWarming #ClimateChange Rally in #Galway    🦆🦆🦆🦆🦆🦆🦆🦆🦆pic.twitter.com/TnZhfYcxmS","","","#GlobalWarming #ClimateChange #Galway","1107030803509362689","https://twitter.com/GaryTraynor21/status/1107030803509362689","🦆 🦆 🦆 🦆 🦆 🦆 🦆 🦆 🦆"
"cosaingalway","2019-03-16 14:51","0","0","Deniers never get tired of regurgitating this lie.    The term #ClimateChange was promoted and popularised by US Republican spin doctor @FrankLuntz, because #GlobalWarming did not poll well with science-phobic and truth-averse conservative voters. https://twitter.com/eliseulascado/status/1106926503705477122 …","","@FrankLuntz","#ClimateChange #GlobalWarming","1106931044643684360","https://twitter.com/cosaingalway/status/1106931044643684360",""
"dunnesta","2019-03-16 09:56","0","0","I don't disagree with you, my main point being that people are generally not empathetic as they should be and the average Joe is dumbed down. Could be a generation thing? Younger people do appear to be more empathetic? Global warming demonstrations yesterday comes to mind.","","","","1106856707177758721","https://twitter.com/dunnesta/status/1106856707177758721",""
"fattybumbum65","2019-03-15 20:37","0","0","12 years ago we were told that the Statue of Liberty would be under water in 2019 and polar bears would be extinct. None of the things have happened. Sure, there’s global warming just not happening as quickly as was predicted. Make kids aware, don’t scare the shit out of them.","","","","1106655668738686976","https://twitter.com/fattybumbum65/status/1106655668738686976",""
"greendotdesign","2019-03-15 10:39","0","0","We are very proud to support the #schoolstrikeforclimate protest today!!!   .  .    #climatechange #youngpeoplematter #youthmovement #globalwarming #thetimeisnow @ Little Green Dot https://www.instagram.com/p/BvBqKr1FacK/?utm_source=ig_twitter_share&igshid=iujczdx4whqj …","","@","#schoolstrikeforclimate #climatechange #youngpeoplematter #youthmovement #globalwarming #thetimeisnow","1106505195930955776","https://twitter.com/greendotdesign/status/1106505195930955776",""
"Noncombination","2019-03-14 21:24","0","1","I served an old farmer earlier   He spent the whole transaction  blaming brexit for Global warming","","","","1106305029575708672","https://twitter.com/Noncombination/status/1106305029575708672",""
"cosaingalway","2019-03-14 10:50","0","1","""Last year’s stark warnings from the Intergovernmental Panel on Climate Change @IPCC_CH, setting out the dramatic impacts of 1.5C of #GlobalWarming, did not include the impacts of potential tipping points such as melting #permafrost.""https://twitter.com/Irishwildlife/status/1106121274907070465 …","","@IPCC_CH","#GlobalWarming #permafrost","1106145633486995456","https://twitter.com/cosaingalway/status/1106145633486995456",""
"TreasaNealon","2019-03-13 22:53","0","0","Facebook and Instagram is down.  The UK is just a mess.  Let’s not talk even about the US.  Global warming is going to kill us.    I feel like we’re in the first book of a trilogy chronicling the apocalypse.","","","","1105965189961338885","https://twitter.com/TreasaNealon/status/1105965189961338885",""
"Lamhfada","2019-03-12 11:23","0","1","This portable all-in-one gaming desk is proof we deserve global warming https://www.pcgamer.com/this-portable-all-in-one-gaming-desk-is-proof-we-deserve-global-warming/ …","","","","1105429141992759296","https://twitter.com/Lamhfada/status/1105429141992759296",""
"trevkeane","2019-03-12 07:25","0","0","If you can help sponsors solve global warming, job done 😀. But to your point, that almost exactly what they want to do. Social conscience and tapping into that then within buyers/brand advocates.","","","","1105369086475882496","https://twitter.com/trevkeane/status/1105369086475882496","😀"
"john003","2019-03-11 11:35","0","0","What about CO2 and global warming","","","","1105069827931193344","https://twitter.com/john003/status/1105069827931193344",""
"RevDaveSyms","2019-03-11 02:52","0","0","It is disgusting the world we are leaving for our kids,global warming,loads of hate,animals and insects becoming extinct,crap healthcare,bad education,political correctness gone mad,no where they can afford to live our parents must be so proud they left us hope and opportunity","","","","1104938098289491975","https://twitter.com/RevDaveSyms/status/1104938098289491975",""
"elonjlerlow","2019-03-10 21:32","0","2","If there's a redundant political group of political parties, it's the middle-class Greens, who despite the disaster of global warming cannot conceptualise a way of stopping it. They're far too comfortable. System change, not climate change. Socialism, not capitalism.","","","","1104857541165617153","https://twitter.com/elonjlerlow/status/1104857541165617153",""
"sarah_oneill1","2019-03-10 14:52","0","0","Thanks for the snow global warming","","","","1104756856709398528","https://twitter.com/sarah_oneill1/status/1104756856709398528",""
"LTovander","2019-03-10 12:09","0","0","U.N. Predicts Disaster if Global Warming Not Checked - The Global Warming Policy Forum (GWPF) https://www.thegwpf.com/u-n-predicts-disaster-if-global-warming-not-checked/ …","","","","1104715809157533697","https://twitter.com/LTovander/status/1104715809157533697",""
"m2cabsy","2019-01-20 15:47","0","1","First of the year Wild Garlic....WTF it's January#nature#sundaywalk#cheflife#globalwarming @ Athlone, Ireland https://www.instagram.com/p/Bs3Ka9uhYJhESW7HW1_1l57hRFG3tcyLBHWhOM0/?utm_source=ig_twitter_share&igshid=jde194765zig …","","@","#nature #sundaywalk #cheflife #globalwarming","1087013814497878016","https://twitter.com/m2cabsy/status/1087013814497878016",""
"LynchEugene","2018-12-10 10:15","0","0","Daffodils for Christmas 😎#globalwarming @ County Cork https://www.instagram.com/p/BrM_50llZax1nzc_vDQNmLjJ7VEmJnSVoyKGH80/?utm_source=ig_twitter_share&igshid=1uql5i0mcup5q …","","@","#globalwarming","1072072327305809920","https://twitter.com/LynchEugene/status/1072072327305809920","😎"
"PlasticFreeKin","2018-10-09 10:23","2","6","💡What is it? 💡  A report by 91 authors from 40 countries and backed up by over 60000 references that assesses the impacts of global warming of 1.5oC and compares this to the impacts of 2oC… https://www.instagram.com/p/BotQpJBAAMZ/?utm_source=ig_twitter_share&igshid=1cfxhxthntm15 …","","","","1049591130583633920","https://twitter.com/PlasticFreeKin/status/1049591130583633920","💡 💡"
