"username","date","retweets","favorites","text","geo","mentions","hashtags","id","permalink","emoji"
"DeclanBurke2","2019-06-12 22:05","0","11","Seriously considering filling the hot water bottles here. Where's this #GlobalWarming gone ? 🤔 @BrianRooney2 @LindaMitton2 @Scottish_Karen @tommyspannerman @mrbobdaly @finnmcool @larkin_shelagh","","@BrianRooney2 @LindaMitton2 @Scottish_Karen @tommyspannerman @mrbobdaly @finnmcool @larkin_shelagh","#GlobalWarming","1138915194321739776","https://twitter.com/DeclanBurke2/status/1138915194321739776","🤔"
"kilkeal","2019-06-09 20:26","0","0","Why destroy a good narrative of global warming https://twitter.com/maturefinancier/status/1137712645870673920 …","","","","1137803053023879170","https://twitter.com/kilkeal/status/1137803053023879170",""
"topgold","2019-06-08 07:40","0","0","Perhaps we should call it the Beach Tax instead of Water Tax. With global warming proven, Ireland will enjoy more beach weather than ever so why not pay more for the privilege?","","","","1137247939330543617","https://twitter.com/topgold/status/1137247939330543617",""
"RobertBohan","2019-06-07 22:01","0","0","That’s an RTÉ programme. As a problem that is is as big a challenge to our natural heritage, more apparent than global warming, I’m really disappointed you are not prepared on this. I suggest you & your colleagues read up on the Irish environment.","","","","1137102350471127042","https://twitter.com/RobertBohan/status/1137102350471127042",""
"discobanco","2019-06-07 17:01","0","0","Tick tock tick tock #ElectricVehicles #GlobalWarming","","","#ElectricVehicles #GlobalWarming","1137026927984877568","https://twitter.com/discobanco/status/1137026927984877568",""
"kilkeal","2019-06-06 12:28","0","0","See what happens with no global warming horrific","","","","1136595685036494850","https://twitter.com/kilkeal/status/1136595685036494850",""
"kilkeal","2019-06-06 12:09","0","0","Everyone knows it's global warming how do you make money otherwise https://twitter.com/NoTricksZone/status/1136553854953238530 …","","","","1136590863465951232","https://twitter.com/kilkeal/status/1136590863465951232",""
"walton_conor","2019-06-03 18:40","1","8","'The Best is Yet to Come'  oil on linen, 45 × 68cm, 2019    #thebestisyettocome #GlobalWarming #churchill #stpatrick #britain #ireland #flooding #artistsoftwitterpic.twitter.com/46RHb2r5Ac","","","#thebestisyettocome #GlobalWarming #churchill #stpatrick #britain #ireland #flooding #artistsoftwitterpic","1135602277484564480","https://twitter.com/walton_conor/status/1135602277484564480",""
"PiccoloartNancy","2019-06-02 17:12","0","0","Give up palm oil.  Palm oil results in genocide, human trafficking and global warming.","","","","1135217736920051713","https://twitter.com/PiccoloartNancy/status/1135217736920051713",""
"wheresgrandad","2019-05-31 23:00","1","13","Remember when Danny Healy Ray explained that god was responsible  for global warming #latelate #LateLateShowpic.twitter.com/Z0RxfmfjRq","","","#latelate #LateLateShowpic","1134580558435143680","https://twitter.com/wheresgrandad/status/1134580558435143680",""
"DavidMurphy1985","2019-05-30 14:58","0","0","Well shut up about global warming then. Its convenience or change. Pick 1","","","","1134096633908645890","https://twitter.com/DavidMurphy1985/status/1134096633908645890",""
"IRISHINSAFIAN","2019-05-28 03:36","11","45","The world’s forests, along with its oceans, absorb enormous amounts of the carbon dioxide that circulates in the atmosphere. They are, effectively, the Earth’s lungs, and protecting those lungs is crucial if we are to defend the planet’s biodiversity and fight global warming. pic.twitter.com/dVL7gpNCw7","","","","1133200325119234048","https://twitter.com/IRISHINSAFIAN/status/1133200325119234048",""
"manwithavandub","2019-05-26 20:56","0","0","#FineGael chasing votes instead of acting on #ClimateChange to a greater extent sooner. #GlobalWarming is hardly news to them. #GreenParty #GreenPartyIreland @ Ireland (country) https://www.instagram.com/p/Bx8DE-GCJzj/?igshid=1iz232o45n8f9 …","","@","#FineGael #ClimateChange #GlobalWarming #GreenParty #GreenPartyIreland","1132737175550930944","https://twitter.com/manwithavandub/status/1132737175550930944",""
"Marcoriain","2019-05-24 19:17","0","1","Have voted for the environment. Politicians in Ireland need to stop paying lip service to global warming. Give your kids a voice! pic.twitter.com/fbcBnKapmZ","","","","1131987636543983617","https://twitter.com/Marcoriain/status/1131987636543983617",""
"speediecelt","2019-05-24 00:05","2","15","Key issue inthe local & European elections are #ClimateChaos, #ClimateJustice & #GreenEconomy.Global Warming, Equality, Poverty, Jobs & Peace are interrelated. Since 2015,I've worked across Africa, Middle East & Europe & have seen the devastation being caused.We need action pic.twitter.com/T7LwDT6h3h","","","#ClimateChaos #ClimateJustice #GreenEconomy","1131697597805191169","https://twitter.com/speediecelt/status/1131697597805191169",""
"LTovander","2019-05-23 10:12","0","0","Brace Yourself: EU faces “Massive Flood Of Plastic Waste” After UN Export Restrictions - The Global Warming Policy Forum (GWPF) https://www.thegwpf.com/brace-yourself-eu-faces-massive-flood-of-plastic-waste-after-un-export-restrictions/ …","","","","1131487964654133249","https://twitter.com/LTovander/status/1131487964654133249",""
"w0tsertits","2019-05-21 16:31","0","1","Been sat outside for about ten minutes just and girls the amount of freckles am seeing already ooof long live global warming pic.twitter.com/VfczBGsCYZ","","","","1130858649465835521","https://twitter.com/w0tsertits/status/1130858649465835521",""
"AlanHarrison","2019-05-21 12:23","0","1","Waring factions united against global warming, but went back to waring once it all got sorted out.","","","","1130796266970124290","https://twitter.com/AlanHarrison/status/1130796266970124290",""
"i_Lilly0k","2019-05-20 17:57","1","1","Global warming expert warns Ireland is 'shrinking' due to climate change erosion https://www.irishmirror.ie/news/irish-news/global-warming-expert-warns-ireland-16169375?utm_source=twitter.com&utm_medium=social&utm_campaign=sharebar …","","","","1130517890808057861","https://twitter.com/i_Lilly0k/status/1130517890808057861",""
"cobyhectic","2019-05-19 21:37","0","1","Also thinks that global warming is a good thing. Blocks those that question him. Populist campaigner. Steer clear.","","","","1130210898633723904","https://twitter.com/cobyhectic/status/1130210898633723904",""
"WaterfordDN","2019-05-18 01:17","0","2","Great to see @GretaThunberg make cover of @TIME magazine. She has said how having #Asperger has contributed to her being the single-minded young woman she is & few voices today deserve to be heard more than hers. What a year she has had! @Strike4Youth #Environment #GlobalWarming https://twitter.com/stevesilberman/status/1129512445167525889 …","","@GretaThunberg @TIME @Strike4Youth","#Asperger #Environment #GlobalWarming","1129541430916145152","https://twitter.com/WaterfordDN/status/1129541430916145152",""
"walter_walper","2019-05-17 14:02","0","0","@BootsUK Shame on boots for those plastic prescription bags, tone you got some sense of civic responsibility. Until then people should get their prescriptions filled in pharmacies that do give a damn about the planet and global warming","","@BootsUK","","1129371501126443008","https://twitter.com/walter_walper/status/1129371501126443008",""
"ratcatcher2","2019-05-17 02:05","8","11","🇮🇪🇮🇪  Having had to use the #Russian Space Station for SO SO long, could it be the 'great' #USA doesn't know the Earth is NOT flat and GLOBAL WARMING is obvious to the Rest🇮🇪🇮🇪  #FixAmericaFirst  When half America is under water, will the Penny drop🇮🇪🇮🇪  Will it still be great🇮🇪https://twitter.com/kevskewl/status/1129167539303530499 …","","","#Russian #USA #FixAmericaFirst","1129191225574268929","https://twitter.com/ratcatcher2/status/1129191225574268929","🇮🇪 🇮🇪 ⁉️ 😁 ⁉️ 😁 ⁉️"
"Crowntheemilyyy","2019-05-15 21:58","0","3","Man to all the people that don’t care about global warming just watch a documentary about it and you’ll soon start to realise how scary it actually is","","","","1128766621764530177","https://twitter.com/Crowntheemilyyy/status/1128766621764530177",""
"dulsel14","2019-05-14 10:17","0","0","Trump has changed a lot of America's mind on global warming it could spill out not to put investment  into the creation of electric  vehicles","","","","1128227842364465152","https://twitter.com/dulsel14/status/1128227842364465152",""
"Squarzelfitz","2019-05-13 18:48","0","0","Global warming modeling is a 99.9% failure","","","","1127994116510498817","https://twitter.com/Squarzelfitz/status/1127994116510498817",""
"cionnai","2019-05-13 08:59","0","0","What’s the alternative ? We can’t go back to living in a cave and burning turf because of global warming. Don’t bother replying unless u show how we will generate electricity the era of fossil fuels is over","","","","1127845886078406656","https://twitter.com/cionnai/status/1127845886078406656",""
"nameiscow","2019-05-10 21:17","0","18","Ever see cunts putting up stuff about global warming and climate change fuck off you hippys","","","","1126944409751306240","https://twitter.com/nameiscow/status/1126944409751306240",""
"putabendejo","2019-05-10 10:49","0","39","Global warming work your magic and give us lethal weather for life","","","","1126786442636812289","https://twitter.com/putabendejo/status/1126786442636812289",""
"KeithCahill","2019-05-09 06:56","0","2","Next they might have a non white councilor too!! Oh my god!! Thankfully the earth is still flat, global warming is made up and the British empire spans half the world....... oh wait!!","","","","1126365313950527516","https://twitter.com/KeithCahill/status/1126365313950527516",""
"NoelDonnellon","2019-05-06 08:10","0","0","How global warming has made the rich richer   http://www.bbc.com/capital/story/20190502-how-global-warming-has-made-the-rich-richer?ocid=ww.social.link.twitter … via @BBC_Capital","","@BBC_Capital","","1125296764989452288","https://twitter.com/NoelDonnellon/status/1125296764989452288",""
"RoisinDubhComed","2019-05-04 20:10","0","0","""So cool he could well be the answer to global warming. Gloriously funny"" - The Scotsman    One of the most prolific and engaging stand-ups of our time, Tom Stade returns to #Galway tomorrow night at 8pm @roisindubhpub . Tix:: http://www.roisindubh.net  now.https://www.youtube.com/watch?v=Z2C5W0fCqbQ …","","@roisindubhpub","#Galway","1124753208117739520","https://twitter.com/RoisinDubhComed/status/1124753208117739520",""
"gengeishanova","2019-05-04 08:13","0","1","Global warming. Time for serious change in mindset of advocates for fossil fuels, cos Texas and other southern states will dessicate + farming will be unsustainable. Africa running out of water in parts. CA fires. USA wake up. CHINA AUS INDIA major polluters #ParisAgreement 2015!https://twitter.com/Justaranch/status/1124270990643662849 …","","","#ParisAgreement","1124572619888562176","https://twitter.com/gengeishanova/status/1124572619888562176",""
"Murandinho","2019-05-02 21:29","0","0","Please don't use that formula for global warming calculations!","","","","1124048355036995584","https://twitter.com/Murandinho/status/1124048355036995584",""
"RoisinDubhComed","2019-05-02 15:27","1","5","""So cool he could well be the answer to global warming"" - @TheScotsman     A frequent highlight at the @galwaycomedy Carnival, @TomStadeComic returns to #Galway this Sunday night at 8pm. Tickets on http://www.roisindubh.net  now.https://www.advertiser.ie/galway/article/107368/tom-stades-generational-conundrums?fbclid=IwAR12RKjUGbqkBHLK8FVxq632C75yakzQi39QwybAJeSYr9qArza7qlLmVbc …","","@TheScotsman @galwaycomedy @TomStadeComic","#Galway","1123957106389004288","https://twitter.com/RoisinDubhComed/status/1123957106389004288",""
"iamcuriousblue","2019-04-30 00:42","28","77","In the bad hot takes department, meat eating and resulting global warming is all the fault of, you guessed it, men. https://web.archive.org/web/20190413132036/https://www.independent.co.uk/voices/fragile-masculinity-mean-eaters-death-vegan-vegetarian-earth-a8855331.html … >","","","","1123009738478899201","https://twitter.com/iamcuriousblue/status/1123009738478899201",""
"boggywood","2019-04-29 18:03","0","0","@drivetimerte @boucherhayes  2/ either 'starving' to death   or a bear clinging to a fast melting ice flow .They were the poster bears for climate change / global warming .Not any more,   because it was all hysterical nonsense.Nat Geo had to do a big apology tour last year over","","@drivetimerte @boucherhayes","","1122909267558830080","https://twitter.com/boggywood/status/1122909267558830080",""
"reallyriann","2019-04-29 17:15","0","3","Like yes, individual actions (keep cups, recycling, diet) can help but you're kidding yourself if you think that individuals alone are  the biggest contributor to global warming","","","","1122897191272701955","https://twitter.com/reallyriann/status/1122897191272701955",""
"PhotogKilkenny","2019-04-29 14:48","0","2","Global Warming - The Hoax of the Twentieth Century - we should have moved along long ago if it weren't for all the media propagandists and amateurs sustaining the myth.","","","","1122860087201161217","https://twitter.com/PhotogKilkenny/status/1122860087201161217",""
"IrishBlue8","2019-04-29 10:21","0","1","I blame global warming","","","","1122792922099978240","https://twitter.com/IrishBlue8/status/1122792922099978240",""
"augeva","2019-04-27 17:03","0","2","I believe @GretaThunberg is a sign of a better future. Now the choice is between having the future on earth or somewhere else. It’s our only choice #globalwarming","","@GretaThunberg","#globalwarming","1122169454471856128","https://twitter.com/augeva/status/1122169454471856128",""
"RobertBohan","2019-04-26 19:47","0","1","There are electricity lines down already & April usually throws up rough weather in Ireland. (And before anyone says global warming, events like this have been recorded back to the 18th C in Ireland)","","","","1121848268806402049","https://twitter.com/RobertBohan/status/1121848268806402049",""
"Popsy45","2019-04-24 23:30","0","0","With a mum this hot no wonder Greta is blaming global warming (disclaimer, this is merely fun. I'll direct you to @toadmeister if you want to see how a real clown tackles Greta's brilliance.)https://twitter.com/tomhfh/status/1120993186124574720 …","","@toadmeister","","1121179578582667265","https://twitter.com/Popsy45/status/1121179578582667265",""
"PhoTangoIrl","2019-04-24 16:01","0","0","@stephenmckeeff your flier not a single word about global warming and the environment. Biggest issue of our time. Shameful #extinctionrebellionireland #ClimateBreakdown #meath #LE19 #fail","","@stephenmckeeff","#extinctionrebellionireland #ClimateBreakdown #meath #LE19 #fail","1121066738504933391","https://twitter.com/PhoTangoIrl/status/1121066738504933391",""
"0edipussy","2019-04-24 10:33","0","13","""I blame the parents"" for letting Greta Thunberg be a voice on global warming. This aul one needs help. https://twitter.com/_HelenDale/status/1120760958622806025 …","","","","1120984051257675776","https://twitter.com/0edipussy/status/1120984051257675776",""
"dotski_w","2019-04-23 20:48","0","1","Going after that EvilOldMan demographic Douglas? Just because you'll be long dead before global warming sees average UK temperatures above 20 degrees","","","","1120776406961741825","https://twitter.com/dotski_w/status/1120776406961741825",""
"Meg_Kearneyx","2019-04-23 12:58","0","9","The fact we literally have 12 years to change the world around to save the planet is so overwhelming, Global Warming is the last thing we should be worried about, all of us doing our part in helping change it bit by bit every day is the best we can do ♻️♻️","","","","1120658212204810240","https://twitter.com/Meg_Kearneyx/status/1120658212204810240","♻️ 🌍"
"PhotogKilkenny","2019-04-22 14:52","1","1","Global warming fanaticism could damage Irish Agriculture and Agri business and the economy itself. We must abolish carbon taxes as fraudulent - thus writes Michael McGrath, Editor of The Kilkenny Journal & candidate for election to Kilkenny County Council.  https://www.facebook.com/KilkennyJournal/posts/2128785383855457?__tn__=K-R-R …pic.twitter.com/mPESWqc11n","","","","1120324594353745920","https://twitter.com/PhotogKilkenny/status/1120324594353745920",""
"LTovander","2019-04-21 09:58","0","0","Cooling Down the Hysteria About Global Warming https://wattsupwiththat.com/2019/04/21/cooling-down-the-hysteria-about-global-warming/ … via @WattsUpWithThat","","@WattsUpWithThat","","1119888146735476737","https://twitter.com/LTovander/status/1119888146735476737",""
"mizzpennydreadf","2019-04-20 20:04","0","2","Wow, imagine if they gave a shit and could/would have donated that amount before to causes like homelessness or global warming?!","","","","1119678337788665856","https://twitter.com/mizzpennydreadf/status/1119678337788665856",""
"Iovehearts","2019-04-20 19:48","0","101","Summer’s here thanks to global warming x  #NewProfilePicpic.twitter.com/hQxb5VU9si","","","#NewProfilePicpic","1119674100811747328","https://twitter.com/Iovehearts/status/1119674100811747328",""
"olivergburke","2019-04-20 19:18","1","2","#Agroecological farming can help to keep #GlobalWarming below 2°C.   French think-tank IDDRI looks at how #climatemitigationstrategies often rely on intensifying #Food production, to increase yields to free up land for afforestation and bioenergy.   https://www.smallholder.co.uk/news/17583795.agroecological-farming-can-help-to-keep-global-warming-below-2c-says-new-report/?ref=twtrec …pic.twitter.com/ZRl7KkskGT","","","#Agroecological #GlobalWarming #climatemitigationstrategies #Food","1119666672279982087","https://twitter.com/olivergburke/status/1119666672279982087",""
"kippaxireland","2019-04-20 14:56","1","1","I'm frightened for the world's future  Millennialism is a bigger threat than global warming https://twitter.com/JJFromTheBronx/status/1118906330197176320 …","","","","1119600681382551552","https://twitter.com/kippaxireland/status/1119600681382551552",""
"LTovander","2019-04-20 10:03","0","0","The Stunning Statistical Fraud Behind The Global Warming Scare https://www.investors.com/politics/editorials/the-stunning-statistical-fraud-behind-the-global-warming-scare/ … via @IBDeditorials","","@IBDeditorials","","1119527096475373569","https://twitter.com/LTovander/status/1119527096475373569",""
"JackmanNeil","2019-04-20 08:06","2","7","Trump: doesn't matter  Brexit: doesn't matter  The chief focus of our politicians and media should be on the fact that we are knowingly destroying our environment    Our leaders are ignoring global warming to the point of criminal negligence. It's unforgivable https://www.theguardian.com/environment/2019/apr/20/our-leaders-are-ignoring-global-warming-to-the-point-of-criminal-negligence-its-unforgivable?CMP=share_btn_tw …","","","","1119497591811715073","https://twitter.com/JackmanNeil/status/1119497591811715073",""
"futbol__97","2019-04-17 18:40","0","0","Incredible people are still slagging off people warning about global warming","","","","1118569995267710976","https://twitter.com/futbol__97/status/1118569995267710976",""
"kv_ofarrell","2019-04-17 16:48","1","3","Prof Donal O'Shea ""obesity is global warming on an individual level"" #ActiveTravel #ClimateActionNow @Irishheart_ie @Cyclistie @IrishCancerSoc @Diabetes_ie @AssocHPIreland @IrishPedestrian @IrishDocsEnvpic.twitter.com/o8K7dDHhnE","","@Irishheart_ie @Cyclistie @IrishCancerSoc @Diabetes_ie @AssocHPIreland @IrishPedestrian @IrishDocsEnvpic","#ActiveTravel #ClimateActionNow","1118541801848229889","https://twitter.com/kv_ofarrell/status/1118541801848229889",""
"SirStevoTimothy","2019-04-17 16:44","7","68","Protesting global warming does work.  I once superglued Kathleen's face to the back of a bus and she was pure cold to me after that","","","","1118540745177272321","https://twitter.com/SirStevoTimothy/status/1118540745177272321",""
"john003","2019-04-16 18:18","0","0","The problem is the tempature  not the CO2..Thats why it's called global warming.....In the 4 years temp went down while CO2 went up....","","","","1118201928893304833","https://twitter.com/john003/status/1118201928893304833",""
"john003","2019-04-16 17:53","0","1","This is global warming since 1880.... pic.twitter.com/sqy2h5J0c5","","","","1118195756232585218","https://twitter.com/john003/status/1118195756232585218",""
"john003","2019-04-16 17:34","0","1","This is a graph of global warming or climate breakdown as the protesters call it since 1880... pic.twitter.com/bzAVDFupMw","","","","1118190977208991745","https://twitter.com/john003/status/1118190977208991745",""
"RoisinDubhComed","2019-04-14 22:08","1","5","“So cool he could well be the answer to global warming. Gloriously funny” - The Scotsman    As seen on Ch4’s Comedy Gala, BBC One’s Michael McIntyre’s Comedy Roadshow, The John Bishop Show and Live at the Apollo.     Tom Stade. May 5th. Róisín Dubh.    https://youtu.be/Z2C5W0fCqbQ ","","","","1117535206133653509","https://twitter.com/RoisinDubhComed/status/1117535206133653509",""
"Dermopj","2019-04-14 15:54","0","0","The numbskulled greens ,they would have us back to the ass and cart  oops the donkey farts would create massive global warming","","","","1117441092381749248","https://twitter.com/Dermopj/status/1117441092381749248",""
"BrianFortune1","2019-04-14 13:02","1","3","...and they say global warming isn't a thing! 😂😂😂#FacebookDown #Instagramdown","","","#FacebookDown #Instagramdown","1117397602402754561","https://twitter.com/BrianFortune1/status/1117397602402754561","😂 😂 😂"
"olivergburke","2019-04-14 11:45","2","0","Global warming could be fuelling the spread of drug resistant superbugs throughout Europe. #GlobalWarming #AMR #antimicrobialresistance  https://www.scotsman.com/news/global-warming-could-be-fuelling-the-spread-of-drug-resistant-superbugs-throughout-europe-1-4907119 …pic.twitter.com/6Z0QEQoNMj","","","#GlobalWarming #AMR #antimicrobialresistance","1117378445565202432","https://twitter.com/olivergburke/status/1117378445565202432",""
"Paddyaherne","2019-04-13 22:57","6","24","You’d have to blame global warming for this shit tomorrow. No longer can Donald Trump and Danny Healy Rae bury their heads in the sand when lads are playing 3 balls, 5 hours early on Masters Sunday","","","","1117185089480351744","https://twitter.com/Paddyaherne/status/1117185089480351744",""
"ColmGannon","2019-04-13 21:18","0","3","Could have done our bit to help the fight against global warming","","","","1117160051083546625","https://twitter.com/ColmGannon/status/1117160051083546625",""
"RamiJam","2019-04-13 13:25","0","4","Also special thanks to Global warming","","","","1117041199783849984","https://twitter.com/RamiJam/status/1117041199783849984",""
"patrickmscc2019","2019-04-12 19:34","0","1","🤣 gone to four wheels Mick!! The cross wind 🤣 on the Tallaght Bypass has increased! Probably Global Warming 🤣 Hope all well with the canvassing 🤣 Paddy","","","","1116771571572576262","https://twitter.com/patrickmscc2019/status/1116771571572576262","🤣 💨 😂 👍🏻"
"LTovander","2019-04-12 12:10","0","0","The Person who Set the Stage for Entire Deception of Human-Caused Global Warming (AGW) – Stephen Schneider. https://wattsupwiththat.com/2019/04/11/the-person-who-set-the-stage-for-entire-deception-of-human-caused-global-warming-agw-stephen-schneider/ … via @WattsUpWithThat","","@WattsUpWithThat","","1116659911532978177","https://twitter.com/LTovander/status/1116659911532978177",""
"TheScaldyVegan","2019-04-11 02:25","0","0","@lidl_ireland is the gift that just keeps on giving! Vegan ice lollies 🤤just in time for global warming 🤤🤤🤤 @ Enniscorthy https://www.instagram.com/p/BwGMNwxgo9g/?utm_source=ig_twitter_share&igshid=1lk9o5g8524my …","","@lidl_ireland @","","1116150233606565889","https://twitter.com/TheScaldyVegan/status/1116150233606565889","🤤 👏 💚 🌱"
"LTovander","2019-04-07 10:50","0","0","Garth Paltridge: Climate’s Uncertainty Principle - The Global Warming Policy Forum (GWPF) https://www.thegwpf.com/garth-paltridge-climates-uncertainty-principle/ …","","","","1114827877109911558","https://twitter.com/LTovander/status/1114827877109911558",""
"kevin_hartigan","2019-04-05 16:47","0","1","On the way home there listening to @TodayFM talking about eating less meat and going vegan 🙈🙈 nothing about all the planes flying around the sky adding to global warming.","","@TodayFM","","1114192911598485504","https://twitter.com/kevin_hartigan/status/1114192911598485504","🙈 🙄"
"LTovander","2019-04-05 09:35","0","0","Europe's Climate Policy: A Disaster In The Making - The Global Warming Policy Forum (GWPF) https://www.thegwpf.com/europes-climate-policy-a-disaster-in-the-making/ …","","","","1114084005744451587","https://twitter.com/LTovander/status/1114084005744451587",""
"FaroqB","2019-04-04 20:25","0","0","And some of yous don’t think global warming is real SMH","","","","1113885340375367681","https://twitter.com/FaroqB/status/1113885340375367681",""
