"username","date","retweets","favorites","text","geo","mentions","hashtags","id","permalink","emoji"
"andyboconnell","2019-09-28 18:35","0","0","Your spot on and city planners are the greatest treat to that sustainable development of my area. The have given greedy developers cart blanche on Student accommodation...the transient tenements of the future. https://twitter.com/RobCross247/status/1177676545571393540 …","","","","1178000279830183936","https://twitter.com/andyboconnell/status/1178000279830183936",""
"DLR_Chamber","2019-09-27 16:00","0","4","Chambers lead the way on Sustainable Development Goals. @DLRCommons @TalbotStill @royalmarine @ToyotaSandyford @RBKACC @OsborneRecruits @tboDublinSouth @CompDoors @AIBIreland @AirfieldEstatepic.twitter.com/POfmZ9H6Nr","","@DLRCommons @TalbotStill @royalmarine @ToyotaSandyford @RBKACC @OsborneRecruits @tboDublinSouth @CompDoors @AIBIreland @AirfieldEstatepic","","1177598871108816901","https://twitter.com/DLR_Chamber/status/1177598871108816901",""
"IRISHINSAFIAN","2019-09-27 13:24","23","111","Side event co-chaired by Prime Minister @ImranKhanPTI and PM @chedetofficial Mahathir Mohammed at the @UN on ‘Environmental Stewardship in Addressing Poverty to Achieve  Sustainable Development for All’ #UNGA2019 #PMIKInUSApic.twitter.com/Gu9I9gQI2F","","@ImranKhanPTI @chedetofficial @UN","#UNGA2019 #PMIKInUSApic","1177559639690551298","https://twitter.com/IRISHINSAFIAN/status/1177559639690551298",""
"BEinIreland","2019-09-24 22:49","0","1","#Belgium calls for ambition in implementing all 17 Sustainable Development Goals #GlobalGoals! #SDGSummit2019 #2030Agendahttps://twitter.com/BelgiumMFA/status/1176597210819170306 …","","","#Belgium #GlobalGoals #SDGSummit2019 #2030Agendahttps","1176614628417245191","https://twitter.com/BEinIreland/status/1176614628417245191",""
"YWIMeath","2019-09-20 15:13","0","0","Well done to those secondary school students protesting the #globalclimatestrike @ywimeath supports climate action and young people #sustainabledevelopment #sdg's @ Navan https://www.instagram.com/p/B2os1rxCN8d/?igshid=wby8v2lr12i0 …","","@ywimeath @","#globalclimatestrike #sustainabledevelopment #sdg","1175050256687476736","https://twitter.com/YWIMeath/status/1175050256687476736",""
"TweetEco","2019-09-20 14:25","0","1","In Dublin with @EducateTogether. Innovative teaching methods,  education for sustainable development, restorative education, inclusion, student-centred ethos and leaving ‘teaching to the test' behind. #educationforsustainabledevelopment #educationpic.twitter.com/2eCfLe3T4f","","@EducateTogether","#educationforsustainabledevelopment #educationpic","1175038322730778625","https://twitter.com/TweetEco/status/1175038322730778625",""
"dfatirl","2019-09-18 15:03","10","37","Tánaiste Simon Coveney is at #Ploughing19 today discussing online passport renewals, Ireland’s place in the EU, the Sustainable Development Goals, and preparing for Brexit.     #GovVillage | #NPC2019pic.twitter.com/aM1rI2G4we","","","#Ploughing19 #GovVillage #NPC2019pic","1174323099828965376","https://twitter.com/dfatirl/status/1174323099828965376",""
"OrdnanceIreland","2019-09-18 13:07","0","3","Want to know more about Sustainable Development Goals and  how we can help? Katie is on hand to give you some information at our stand #GovPloughing19 #GovVillage #OSi #SDGspic.twitter.com/3o5WA4Ius7","","","#GovPloughing19 #GovVillage #OSi #SDGspic","1174293768343826433","https://twitter.com/OrdnanceIreland/status/1174293768343826433",""
"dfatirl","2019-09-17 16:23","21","86","Minister Helen McEntee visited our #SDG space earlier here at #Ploughing2019 to explore the UN Sustainable Development Goals.     The #SDGs are 17 Goals to make our world a fairer, greener and more peaceful place by 2030.     #GovVillage | #NPC2019pic.twitter.com/UAKlyBonop","","","#SDG #Ploughing2019 #SDGs #GovVillage #NPC2019pic","1173980773457846273","https://twitter.com/dfatirl/status/1173980773457846273",""
"merrionstreet","2019-09-17 14:50","9","32","Keep an eye out for the Sustainable Development Goals across the #GovVillage at #Ploughing19. Visit all the exhibitors displaying a SDG card to collect all 17 SDG stickers. #SDGsIRL @Dept_CCAEpic.twitter.com/4plyvZ1kIl","","@Dept_CCAEpic","#GovVillage #Ploughing19 #SDGsIRL","1173957511176757249","https://twitter.com/merrionstreet/status/1173957511176757249",""
"DF_COS","2019-09-08 10:41","8","36","Thank you to @AmbRobinBarnett UK Ambassador to Ireland & Agnieszka for #Sustainability theme @BritEmbDublin Summer event this week. Normalizing progress in Sustainable Development Goals #SDGs, at individual, organization, state, & regional levels is essential for global security.pic.twitter.com/JChxyXgASL","","@AmbRobinBarnett @BritEmbDublin","#Sustainability #SDGs","1170633333883187200","https://twitter.com/DF_COS/status/1170633333883187200",""
"IRISHINSAFIAN","2019-09-06 01:35","1","12","@naeemul_haque Presiding over a meeting on Sustainable Development Goals @PTIofficialpic.twitter.com/sWTDAuZM9E","","@naeemul_haque @PTIofficialpic","","1169771104908566528","https://twitter.com/IRISHINSAFIAN/status/1169771104908566528",""
"orourke_darren","2019-09-04 18:46","0","1","Sorry, maybe I should’ve been more explicit (mea culpa). As far as I’m concerned if it doesn’t prioritise public transport and cycling then it’s not “sustainable development”. 👍","","","","1169305728504479744","https://twitter.com/orourke_darren/status/1169305728504479744","👍"
"MaryOShaughne16","2019-09-04 10:57","5","18","We’re looking forward to welcoming our @MSCActions @ActionRur ESRs to @UCC today for the first day of the @CUBSucc @BallyhouraDev PhD Autumn Skills Seminar on #SocEnt and #SustainableDevelopment #ruralpic.twitter.com/YWqMXqrOs2","","@MSCActions @ActionRur @UCC @CUBSucc @BallyhouraDev","#SocEnt #SustainableDevelopment #ruralpic","1169187702778019840","https://twitter.com/MaryOShaughne16/status/1169187702778019840",""
"IRISHINSAFIAN","2019-09-01 17:30","115","540","Deputy Speaker, National Assembly, @QasimKhanSuri on Sunday raised the Kashmir cause at Sustainable Development Goals, Summit and apprised the participants about the unconstitutional steps and atrocities being committed by Indian government on innocent people of IO J&K. #Kashmirpic.twitter.com/BXwj1Dyj3u","","@QasimKhanSuri","#Kashmirpic","1168199574726557697","https://twitter.com/IRISHINSAFIAN/status/1168199574726557697",""
"DaithiDoolan","2019-08-31 12:55","2","5","Hard at it! Campaigning for proper, sustainable development in Cherry Orchard. Demanding services, homes, schools & sports facilities @aosnodaigh @DublinSinnFeinpic.twitter.com/4tnFJOKtlR","","@aosnodaigh @DublinSinnFeinpic","","1167767895302168581","https://twitter.com/DaithiDoolan/status/1167767895302168581",""
"LiamLachs","2019-08-27 19:31","0","4","To young scientists, and those interested in sustainable development:    The science we produce doesn't stop after publication. We can take it the next step by communicating widely and through organisations like EMB who help translate it for policy makers to make real change!!","","","","1166417911940100097","https://twitter.com/LiamLachs/status/1166417911940100097",""
"anderskb_","2019-08-27 12:19","4","19","Well done @AtlanticAll @AllAtlanticO Youth Ambassadors for presenting creative and inspiring ideas to promote sustainable development and stewardship of the #AtlanticOcean   | #AtlanticAll #AtlanticYouth #oceanliteracy #SustainableOcean #sdg14pic.twitter.com/gG6ekV4by0","","@AtlanticAll @AllAtlanticO","#AtlanticOcean #AtlanticAll #AtlanticYouth #oceanliteracy #SustainableOcean #sdg14pic","1166309268338987008","https://twitter.com/anderskb_/status/1166309268338987008",""
"ei_LRogers","2019-08-22 12:33","9","18","Really insightful and inspiring morning listening to @EnactusTCD. Phenomenal work being done on social entrepreneurship projects to contribute to Sustainable Development Goals. Everyone @Entirl wishes you well in the @enactus #WorldCup in Silicon Valley ☘️pic.twitter.com/T2g2hMVgdp","","@EnactusTCD @Entirl @enactus","#WorldCup","1164500908790767616","https://twitter.com/ei_LRogers/status/1164500908790767616","☘️"
"da_sweetthin","2019-08-22 09:51","0","0","I desire sustainable development in this my life sha.","","","","1164460176130412545","https://twitter.com/da_sweetthin/status/1164460176130412545",""
"PEDeBauw","2019-08-12 19:26","1","5","Inspiration from #Belgium: challenging urban mobility schemes of the past is key to sustainable development and reducing CO2 emissions!  🇧🇪🇧🇪 Glad that Belgium and #Ireland join efforts in #ClimateAction within the #EU!  @Dept_CCAE @RichardbrutonTD @McMarghem https://twitter.com/BEinIreland/status/1160972078880829441 …pic.twitter.com/Q3QF6ld6F1","","@Dept_CCAE @RichardbrutonTD @McMarghem","#Belgium #Ireland #ClimateAction #EU","1160980967886139392","https://twitter.com/PEDeBauw/status/1160980967886139392","🇧🇪 🇮🇪"
"Franklya1","2019-07-31 13:15","0","2","Another reason to increase investment in the public transport sector in Ireland. These workers could meaningfully contribute to sustainable development & environment! “~1,500 jobs at risk at Ryanair as airline confirms cuts are unavoidable”  via @IrishTimeshttps://www.irishtimes.com/business/transport-and-tourism/up-to-1-500-jobs-at-risk-at-ryanair-as-airline-confirms-cuts-are-unavoidable-1.3972967 …","","@IrishTimeshttps","","1156538940855394304","https://twitter.com/Franklya1/status/1156538940855394304",""
"FastrackintoIT","2019-07-30 14:58","3","10","Apprenticeships are key to the  Sustainable Development Goals in providing decent work & economic growth for all #Ireland4SDGs #Globalgoals @apprenticesIrlpic.twitter.com/NrOUTp3puI","","@apprenticesIrlpic","#Ireland4SDGs #Globalgoals","1156202409842085888","https://twitter.com/FastrackintoIT/status/1156202409842085888",""
"philkearney","2019-07-30 10:47","4","21","Commitment to ‘economic growth’ holes #UN_SDGs below the waterline. Sustainable development based on economic growth is pure oxymoron. https://twitter.com/Dept_CCAE/status/1156133438203879424 …","","","#UN_SDGs","1156139274049339393","https://twitter.com/philkearney/status/1156139274049339393",""
"merrionstreet","2019-07-30 10:27","6","15","UN Sustainable Development Goals are a series of 17 goals and 169 targets agreed at UN level in 2015. Ireland is working on a whole-of-Government basis to support implementation. pic.twitter.com/veqNRsGMKR","","","","1156134290763190272","https://twitter.com/merrionstreet/status/1156134290763190272",""
"OneFineDay_ie","2019-07-26 00:22","0","1","How to make an impact with the sustainable development goals -   Your impact story brings your vision to life. #SDGs #SustainableDevelopmentGoals #SocialImpact #Socent #Socinnhttps://changecreator.com/how-to-make-an-impact-with-the-sustainable-development-goals/ …","","","#SDGs #SustainableDevelopmentGoals #SocialImpact #Socent #Socinnhttps","1154532378116706305","https://twitter.com/OneFineDay_ie/status/1154532378116706305",""
"concernactive","2019-07-12 14:02","1","2","Question 1: 'Leave no one behind' sums up the 2030 agenda for sustainable development.     What does this mean? 🤔    #SDGs #ProjectUs @SpunOutpic.twitter.com/BleIqvIOLF","","@SpunOutpic","#SDGs #ProjectUs","1149665428316119047","https://twitter.com/concernactive/status/1149665428316119047","🤔"
"OisinCoghlan","2019-07-11 00:10","2","9","So @aine_awwnya, @foeireland’s Activism Support Coordinator, is an observer with @Coalition2030IR at a UN annual forum on achieving the 2030 Sustainable Development Goals. Goal 13 on Climate is on agenda. Áine’ll be tweeting about the issues, the people & the process #HLPLF2019https://twitter.com/aine_awwnya/status/1148699534823964679 …","","@aine_awwnya @foeireland @Coalition2030IR","#HLPLF2019https","1149093628243038208","https://twitter.com/OisinCoghlan/status/1149093628243038208",""
"TheJackOConnor","2019-07-08 16:58","0","0","@MoyoNua has been featured in the @Limerick_Leader. Give a read to find some really honest insights on sustainable development and youth entrepreneurship from Catherine and I below! https://twitter.com/Catherine_H98/status/1148259519342026752 …","","@MoyoNua @Limerick_Leader","","1148259995751989248","https://twitter.com/TheJackOConnor/status/1148259995751989248",""
"lucky1017","2019-07-02 13:26","0","1","Limerick Lane which joins Foxes Bow with Little Catherine St seems to be mainly used for car parking & bins. A waste of that space & Limerick target under Green Leaf nomination is #SustainableDevelopment☹️","","","#SustainableDevelopment","1146032463979995137","https://twitter.com/lucky1017/status/1146032463979995137","☹️"
"allisonpharma","2019-06-29 18:50","0","1","The best tweet I’ve ever seen about UN Sustainable Development Goals 🤣 Get well soon!! #PrideMarch2019 #SustainableDevelopmentGoals #healthpromotionhttps://twitter.com/BarryOSullivan/status/1144638353884819456 …","","","#PrideMarch2019 #SustainableDevelopmentGoals #healthpromotionhttps","1145026673810780162","https://twitter.com/allisonpharma/status/1145026673810780162","🤣"
"c_mcelligott","2019-06-28 11:42","0","0","You can’t expect every private development to meet what you define as interesting. We have a national housing crisis. This development will provide 200 units (albeit for the top end rental market) ABP will assess this in the interests of proper planning & sustainable development","","","","1144556615053533185","https://twitter.com/c_mcelligott/status/1144556615053533185",""
"Delboysmate","2019-06-28 10:33","1","3","This CEO is from the moon. He does not seem to care much about proper planning & sustainable development. Councillors, even Mike Crowe, are right to be angry. Colette Connolly too. Nuts on a Flood Plain? He wants to keep 500 car parking spaces in because it makes money for Corpo!","","","","1144539325742403585","https://twitter.com/Delboysmate/status/1144539325742403585",""
"IrishGBC","2019-06-27 11:04","1","0","Are you ready to be a LEED Green Associate? Become a leader in green buildings by coming to our LEED training on 22/07/2019 at our offices in Dublin. For more info go to our website https://www.igbc.ie/events/leed-ga-green-associate-training-12/ …  #LEED #SustainableDevelopment #GreenerFuture #Sustainability","","","#LEED #SustainableDevelopment #GreenerFuture #Sustainability","1144184835503796225","https://twitter.com/IrishGBC/status/1144184835503796225",""
"aeonstrategy","2019-06-25 12:26","1","4","Our Founding Partner Noura Turki AlSaud is discussing Sustainable Development and the Challenges & Opportunities for Energy Efficiency Faced by the Private Sector in Saudi Arabia | 4th Annual Global Conference on Energy Efficiency @IEA #energyefficientworldpic.twitter.com/T1EugdFTSM","","@IEA","#energyefficientworldpic","1143480685287661568","https://twitter.com/aeonstrategy/status/1143480685287661568",""
"CIFMERS","2019-06-14 12:06","1","2","Again the #Sustainable Development Goals come up at the #EFMC2019 because yes, we at #FacilityManagement can have an impact!  @EuroFMpic.twitter.com/UDsp6PPegy","","@EuroFMpic","#Sustainable #EFMC2019 #FacilityManagement","1139489293171384321","https://twitter.com/CIFMERS/status/1139489293171384321",""
"CIFMERS","2019-06-14 12:01","0","2","Common Startegies for Sustainable Development of #FacilityManagement and Transport.  Peter Luvkert from @OECD at #EFMC2019pic.twitter.com/Tf9XFdYdXJ","","@OECD","#FacilityManagement #EFMC2019pic","1139488020447580162","https://twitter.com/CIFMERS/status/1139488020447580162",""
"CIFMERS","2019-06-14 11:56","1","2","#FacilityManagement can impact on many of the #Sustainable Development Goals  #EFMC2019pic.twitter.com/ozWNDAmhBz","","","#FacilityManagement #Sustainable #EFMC2019pic","1139486749799911425","https://twitter.com/CIFMERS/status/1139486749799911425",""
"donaloc","2019-06-12 21:00","6","10","#FODCUpdate: @McAleer_1 and myself proposed the adoption as an action point a motion to oppose Fracking & Gold Mining in its draft Sustainable Development Action Plan. Voted down 2 for, 19 against, 3 abstentions.","","@McAleer_1","#FODCUpdate","1138898861311893504","https://twitter.com/donaloc/status/1138898861311893504",""
"forestsomewhere","2019-06-08 21:03","0","5","Also, can I just point out the ingenuity and cuteness of these tattoos highlighting the Sustainable Development Goals #sdg #SeaFest19pic.twitter.com/ouODx35b5d","","","#sdg #SeaFest19pic","1137450095111266304","https://twitter.com/forestsomewhere/status/1137450095111266304",""
"am_flynn","2019-06-05 11:50","1","6","This is news that brings with it huge potential for sustainable development in our area. If you’re from North #Mayo, West #Sligo, or have an interest in the area, please engage with this process.https://twitter.com/BallinaLions/status/1136220365628293121 …","","","#Mayo #Sligo","1136223841351622656","https://twitter.com/am_flynn/status/1136223841351622656",""
"Vartryreservoir","2019-06-02 17:48","2","4","In addition to raise the awareness of climate change and sustainable development, our @e3_garden also provides a sustainable solution to the water shortage issue. This is what we engineers @tcdengineering   do! @tcddublin @bloominthepark #Bloom2019","","@e3_garden @tcdengineering @tcddublin @bloominthepark","#Bloom2019","1135226733689528322","https://twitter.com/Vartryreservoir/status/1135226733689528322",""
"giyireland","2019-06-02 12:01","5","15","What an amazing panel for our ‘Chefs Manifesto’ chat. How can Chefs contribute to the sustainable development goals? @Spaceychef @JBDuboisChef @BallyknockenHCS @EggandChick @mistereatgalway #Bloom2019pic.twitter.com/Wx3blIqq6x","","@Spaceychef @JBDuboisChef @BallyknockenHCS @EggandChick @mistereatgalway","#Bloom2019pic","1135139256819752960","https://twitter.com/giyireland/status/1135139256819752960",""
"Vartryreservoir","2019-06-01 20:54","1","4","Very glad that our @e3_garden 's message about sustainable development is well received by visitors at @bloominthepark @tcddublin @pjprendergast @tcdengineeringpic.twitter.com/sCMUJF64ez","","@e3_garden @bloominthepark @tcddublin @pjprendergast @tcdengineeringpic","","1134911153216335874","https://twitter.com/Vartryreservoir/status/1134911153216335874",""
"marialuskgreen","2019-05-26 09:18","0","2","Very similar story to mine. As a student of Ecology, Sustainable Development at ECOUNESCO, went to do my work experience in the HQ back in 2015. Spend incredible 3 months with Irish Greens and joined the party as a result. Feel totally proud of each & everyone of them today 💚💚","","","","1132561711091847168","https://twitter.com/marialuskgreen/status/1132561711091847168","💚 🙌"
"SERVE_ie","2019-05-25 14:34","1","6","Team Vietnam ready to join the Centre for Sustainable Development Studies in Vietnam #SolidarityInAction 🇻🇳pic.twitter.com/KsJXx2sWPd","","","#SolidarityInAction","1132278696088408065","https://twitter.com/SERVE_ie/status/1132278696088408065","🇻🇳"
"askeatondbp","2019-05-22 09:18","0","3","We hope to see the new MEPs supporting the Sustainable Development Goals even further especially Goal 4 which is the base of our project🌍🌍 @YSInow @ECOUNESCO #YEA19https://twitter.com/IrishEnvNet/status/1130434646121091072 …","","@YSInow @ECOUNESCO","#YEA19https","1131112094219350017","https://twitter.com/askeatondbp/status/1131112094219350017","🌍 😃"
"Fergusodowd","2019-05-14 10:52","0","3","Final day at the @BritishIrishPA Plenary in Wicklow. Report on port security one of the main topics of discussions today following our recent high level meetings with port authorities, we will also be discussing Sustainable Development Goals with reps from @nycinewspic.twitter.com/4aSH9i7lsL","","@BritishIrishPA @nycinewspic","","1128236692543090688","https://twitter.com/Fergusodowd/status/1128236692543090688",""
"YWIMeath","2019-05-02 20:44","0","4","Congratulations to all the members of Navan @ECOUNESCO group who received their certificates of completion on Wednesday after undertaking the 12 week Youth for Sustainable Development programme.    #SDGs #youthwork #sustainability #ireland #global #communitypic.twitter.com/qrAt9R8daj","","@ECOUNESCO","#SDGs #youthwork #sustainability #ireland #global #communitypic","1124036942755188744","https://twitter.com/YWIMeath/status/1124036942755188744",""
"MeathChambers","2019-05-02 18:58","0","1","@ChambersIreland calls on all #LE19 candidates to support smart and sustainable development through investing in green energy and enterprise training to help people supplement their agri-food incomes - see our Local Elections Manifesto here http://buff.ly/2GGw2xG  #OurTimeToVotepic.twitter.com/qLYy1WcNXS","","@ChambersIreland","#LE19 #OurTimeToVotepic","1124010325605527552","https://twitter.com/MeathChambers/status/1124010325605527552",""
"Fairtrade_ie","2019-05-01 10:20","2","3","Through paying workers a fair wage for their work, investing in quality healthcare & education through the Fairtrade premium & through our work with the Sustainable Development Goals, particularly goals 5 & 8 Fairtrade continues to push for better conditions for workers today","","","","1123517638376853506","https://twitter.com/Fairtrade_ie/status/1123517638376853506",""
"organiccentreie","2019-04-28 12:53","6","7","Catriona Rogerson from @IrishEnvNet talking to a packed crowd about the Sustainable Development Goals which acknowledge we live in finite planet. #OrganicCentre #SustainableFoodProduction on 12-5pm Free event.  #SDGs #Ireland @restawards @ruairimckiernanpic.twitter.com/X0Ma3wiuke","","@IrishEnvNet @restawards @ruairimckiernanpic","#OrganicCentre #SustainableFoodProduction #SDGs #Ireland","1122468878997757954","https://twitter.com/organiccentreie/status/1122468878997757954",""
"Delboysmate","2019-04-27 19:20","0","3","With respect, it wasn't made clear Emma. Just brushed over as usual. Nobody gets it at all. If An Taisce did not exist, this country would be much worse off as few of the other prescribed bodies make much effort to ensure the proper planning and sustainable development is needed.","","","","1122203943529066497","https://twitter.com/Delboysmate/status/1122203943529066497",""
"MrkBnt","2019-04-25 09:52","27","34","DCU running this great event on 2 May: Sustainable Development Goals - Recognising and Enhancing our Research Contribution. Important work and a great format to explain it! @RoLyonz @robgillanders @muirtheimhne https://www.eventbrite.com/e/dcu-and-the-sustainable-development-goals-recognising-and-enhancing-our-research-contribution-tickets-60311021890?aff=estw … #TalentGarden @talentgardenie @AliJSheridanpic.twitter.com/rwm073Bt5o","","@RoLyonz @robgillanders @muirtheimhne @talentgardenie @AliJSheridanpic","#TalentGarden","1121336081532760064","https://twitter.com/MrkBnt/status/1121336081532760064",""
"Fairtrade_ie","2019-04-25 09:36","0","0","The @UN ‘s Sustainable Development Goals aim to end malaria and other communicable diseases by 2030    Check out Fairtrade’s work with the SDGs here https://www.fairtrade.ie/get-involved/fairtrade-fortnight/ …  #SDG3 #EndMalaria #ReadyToBeatMalaria","","@UN","#SDG3 #EndMalaria #ReadyToBeatMalaria","1121332130133553152","https://twitter.com/Fairtrade_ie/status/1121332130133553152",""
"BEinIreland","2019-04-24 14:29","4","13","🗣 On #DiplomacyDay we reaffirm the central place of #Multilateralism and international cooperation at the 🗣 of @BelgiumMFA’s policies and actions.  🗣 Peace,  🗣 Human rights,   🗣 Sustainable development,  All 🗣 challenges requiring   #Diplomacy4Peace! #MultilateralismMatterspic.twitter.com/WGiqfytp1W","","@BelgiumMFA","#DiplomacyDay #Multilateralism #Diplomacy4Peace #MultilateralismMatterspic","1121043480837599232","https://twitter.com/BEinIreland/status/1121043480837599232","🗣 💙 🕊 🌈 🍃 🌎"
"SheilaNunan","2019-04-24 12:23","7","24","With Dennis Sinyolo from Education Ireland at #INTOCongress19 I worked hard to secure Quality Education as a Sustainable Development Goal at the United Nations when it was under attack. #SustainableDevelopment #EducationForAll #UNpic.twitter.com/qmKnd4k8mH","","","#INTOCongress19 #SustainableDevelopment #EducationForAll #UNpic","1121011714412171264","https://twitter.com/SheilaNunan/status/1121011714412171264",""
"eoinneylon","2019-04-24 11:36","0","1","Can't but agree Philip. Some areas seem to have been prioritised over the rest in our area. There needs to be a more even spread of investment & services for a more sustainable development in our part of the city. As I voiced at the Scout Hall meeting a few weeks ago......","","","","1120999977893924864","https://twitter.com/eoinneylon/status/1120999977893924864",""
"iamcalebdee","2019-04-23 13:44","0","2","It's #earthday2019, incidentally, I saw this giant whale made from plastic collections at Utrecht City Centre.The obvious msg is to save the aquatics from plastic pollution.The msg about sustainable development is very much out there but how much are we willing to commit to such? pic.twitter.com/dlY5oVHtod","","","#earthday2019","1120669737124597760","https://twitter.com/iamcalebdee/status/1120669737124597760",""
"ECOUNESCO","2019-04-17 18:52","3","4","To celebrate upcoming #earthday, we had a scavenger hunt with our #dublin Your for Sustainable Development Programme in Stephens Green Park  What are your plans? #Earthday2019pic.twitter.com/zCGw6nDuVR","","","#earthday #dublin #Earthday2019pic","1118572954848198656","https://twitter.com/ECOUNESCO/status/1118572954848198656"," 🌍"
"CephalopodsRule","2019-04-16 13:56","0","1","Not sure ahaha :P    Leaning towards a 2 year Masters in Sustainable development at the moment","","","","1118135985404022794","https://twitter.com/CephalopodsRule/status/1118135985404022794",""
